FID,geom,OBJECTID,NAMOBJ,FCODE,REMARK,METADATA,SRS_ID,JPLYRS,RSALAMAT,WADMKK,TELEPON,TIPRST
RUMAHSAKIT_PT_50K_2023_JAWABARAT.296,POINT (-6.1780526669999745 107.01255060000005),1496,RS Ibu dan Anak Viola,GI01050100,Perorangan,528c628d-bc92-447d-8d1f-a0e99c7dc40f,SRGI2013,0,Jl. Pondok Ungu Permai Sektor V A1 No 22-26,Bekasi,021-88983843,C
RUMAHSAKIT_PT_50K_2023_JAWABARAT.297,POINT (-6.361889803999929 107.11803630000009),1497,RS Umum Budi Asih,GI01050100,Perorangan,528c628d-bc92-447d-8d1f-a0e99c7dc40f,SRGI2013,0,Jl. Raya Serang-Cibarusah 001/001 Ds. Serang Kec. CIkarang Kab. Bekasi,Bekasi,2189677795,D
RUMAHSAKIT_PT_50K_2023_JAWABARAT.298,POINT (-7.308878728999957 108.20955500000008),1498,RS Ibu dan Anak Bunda Aisyah,GI01050100,Swasta / Lainnya,528c628d-bc92-447d-8d1f-a0e99c7dc40f,SRGI2013,0,Jl. RE. Martadinata No. 200 B Cipedes Kota Tasikmalaya,Kota Tasikmalaya,(0265) 7297401,C
RUMAHSAKIT_PT_50K_2023_JAWABARAT.299,POINT (-6.325979801999949 107.12757150000004),1499,RS EMC Cikarang,GI01050100,Perusahaan,528c628d-bc92-447d-8d1f-a0e99c7dc40f,SRGI2013,0,"Komplek Oasis Kav. 1, Jl. Raya Cikarang Cibarusah, Kelurahan Sukaresmi, Kecamatan Cikarang Selatan.",Bekasi,021-29779977,B
RUMAHSAKIT_PT_50K_2023_JAWABARAT.300,POINT (-6.531670100999975 107.43959970000009),1500,RS Umum Karina Medika,GI01050100,Perusahaan,528c628d-bc92-447d-8d1f-a0e99c7dc40f,SRGI2013,0,JL Baru Kp. Krajan RT 39 RW 01 Desa Maracang Kec. Babakancikao Kab. Purwakarta 41151,Purwakarta,0264-8301768,D
RUMAHSAKIT_PT_50K_2023_JAWABARAT.301,POINT (-6.906316063999952 107.59837050000004),1501,RS Umum Melinda 2,GI01050100,Swasta / Lainnya,528c628d-bc92-447d-8d1f-a0e99c7dc40f,SRGI2013,0,Jl. Dr. Cipto No.1 Bandung,Kota Bandung,022 - 4233 777,C
RUMAHSAKIT_PT_50K_2023_JAWABARAT.302,POINT (-7.2141828839999675 107.13925220000004),1502,RS Umum Daerah Pagelaran,GI01050100,Pemerintah Kabupaten,528c628d-bc92-447d-8d1f-a0e99c7dc40f,SRGI2013,0,JL.Raya Pagelaran No 18 Desa Pagelaran Kec. Pagelaran Kab. Cianjur 43266,Cianjur,0263-2361093,D
RUMAHSAKIT_PT_50K_2023_JAWABARAT.303,POINT (-6.567082457999959 106.85375620000008),1503,RS EMC Sentul,GI01050100,Perusahaan,528c628d-bc92-447d-8d1f-a0e99c7dc40f,SRGI2013,0,"Jl. MH. Thamrin Kav. 57 Sentul City, Bogor 16810",Bogor,021-29672977,B
RUMAHSAKIT_PT_50K_2023_JAWABARAT.304,POINT (-6.1234907319999365 106.99245950000005),1504,RS Umum Tarumajaya,GI01050100,Swasta / Lainnya,528c628d-bc92-447d-8d1f-a0e99c7dc40f,SRGI2013,0,"Jalan Raya Tarumajaya No. 1B, Pantai Makmur Tarumajaya, Bekasi",Bekasi,88992337,D
RUMAHSAKIT_PT_50K_2023_JAWABARAT.305,POINT (-6.958384458999944 106.89792900000003),1505,RS Umum Daerah Al-Mulk,GI01050100,Pemerintah Kota,528c628d-bc92-447d-8d1f-a0e99c7dc40f,SRGI2013,0,"Jl. Pelabuhan 2 KM 6, Lembursitu",Kota Sukabumi,(0266) 6220941,D
RUMAHSAKIT_PT_50K_2023_JAWABARAT.306,POINT (-6.862813498999969 107.50987880000008),1506,RS Umum IMC,GI01050100,Perusahaan,528c628d-bc92-447d-8d1f-a0e99c7dc40f,SRGI2013,0,Jl. Raya Cimareme RT. 01 RW. 02 Ds Cimareme Kec Ngamprah Kab Bandung Barat,Bandung Barat,226620923,D
RUMAHSAKIT_PT_50K_2023_JAWABARAT.307,POINT (-6.318190827999956 107.01223870000007),1507,RS Umum Satria Medika,GI01050100,Swasta / Lainnya,528c628d-bc92-447d-8d1f-a0e99c7dc40f,SRGI2013,0,Jl. Raya Bantar Gebang Setu No 119 Kel Padurenan Kec Mustika Jaya,Kota Bekasi,2122105678,C
RUMAHSAKIT_PT_50K_2023_JAWABARAT.308,POINT (-6.223736977999977 107.03163900000004),1508,RS Umum Pinna,GI01050100,Swasta / Lainnya,528c628d-bc92-447d-8d1f-a0e99c7dc40f,SRGI2013,0,Jl. Karang Satria No. 4-5 Bekasi,Bekasi,8827554,D
RUMAHSAKIT_PT_50K_2023_JAWABARAT.309,POINT (-7.336186941999927 108.15360050000004),1509,RS Ibu dan Anak Respati,GI01050100,Perusahaan,528c628d-bc92-447d-8d1f-a0e99c7dc40f,SRGI2013,0,Jl. Raya Singaparna KM 11 Cikunir Singaparna,Tasikmalaya,0265 549337,C
RUMAHSAKIT_PT_50K_2023_JAWABARAT.310,POINT (-6.571074461999956 106.62527220000004),1510,RS Umum Asysyifaa,GI01050100,Swasta / Lainnya,528c628d-bc92-447d-8d1f-a0e99c7dc40f,SRGI2013,0,Jl. Raya Leuwiliang Cibeber 1 Kab Bogor 16640,Bogor,0251 8641142,C
RUMAHSAKIT_PT_50K_2023_JAWABARAT.311,POINT (-6.913233963999971 107.64560230000006),1511,RS Ibu dan Anak Grha Bunda,GI01050100,Swasta / Lainnya,528c628d-bc92-447d-8d1f-a0e99c7dc40f,SRGI2013,0,Jl. Terusan Jakarta No. 15-17 Kec. Kiaracondong kota Bandung,Kota Bandung,(022) 872-56789,C
RUMAHSAKIT_PT_50K_2023_JAWABARAT.312,POINT (-6.704498648999959 108.35724970000007),1512,RS Mitra Plumbon Majalengka,GI01050100,Perusahaan,528c628d-bc92-447d-8d1f-a0e99c7dc40f,SRGI2013,0,"Jl. Raya Barat Pasar Prapatan No. 109 Desa Panjalin Kidul Kec. Sumberjaya , Kab. Majalengka 45455",Majalengka,81320679545,C
RUMAHSAKIT_PT_50K_2023_JAWABARAT.313,POINT (-6.93753985799998 107.62373310000004),1513,RS Mata Bandung Eye Center,GI01050100,Swasta / Lainnya,528c628d-bc92-447d-8d1f-a0e99c7dc40f,SRGI2013,0,Jl. Buah Batu No.147 Kel. Turangga Kec. Lengkong Kota Bandung,Kota Bandung,022 73514682,C
RUMAHSAKIT_PT_50K_2023_JAWABARAT.314,POINT (-6.346540711999978 108.33957550000008),1514,RS Umum Pertamina Balongan Indramayu,GI01050100,BUMN,528c628d-bc92-447d-8d1f-a0e99c7dc40f,SRGI2013,0,Jl. Bumi Patra No. 1 Komplek Perum Pertamina Indramayu.,Indramayu,0234 7121 607,D
RUMAHSAKIT_PT_50K_2023_JAWABARAT.315,POINT (-6.283742769999947 107.45742020000006),1515,RS Umum Amanda Mitra Keluarga,GI01050100,Perusahaan,528c628d-bc92-447d-8d1f-a0e99c7dc40f,SRGI2013,0,Jl. Raya Buahaseum Desa Karya Mukti Kec. Lemahabang Wadas Kab. Karawang,Karawang,0267 8620645,D
RUMAHSAKIT_PT_50K_2023_JAWABARAT.316,POINT (-6.372991213999967 106.84384010000008),1516,RS Umum Citra Arafiq,GI01050100,Perusahaan,528c628d-bc92-447d-8d1f-a0e99c7dc40f,SRGI2013,0,Jl. Perindustrian Raya No.53 Baktijaya Sukmajaya,Kota Depok,2122821911,C
RUMAHSAKIT_PT_50K_2023_JAWABARAT.317,POINT (-6.949810253999942 107.76306110000007),1517,RS Umum Harapan Keluarga,GI01050100,Perusahaan,528c628d-bc92-447d-8d1f-a0e99c7dc40f,SRGI2013,0,Jl Raya Cipacing - Rancaekek KM 20 Jatinangor Sumedang,Sumedang,227796335,D
RUMAHSAKIT_PT_50K_2023_JAWABARAT.318,POINT (-6.486926480999955 106.87757490000007),1518,RS Helsa Citeureup,GI01050100,Perusahaan,528c628d-bc92-447d-8d1f-a0e99c7dc40f,SRGI2013,0,"Jl. Mayor Oking Jaya Atmaja No. 92A, Ds. Karang Asem Barat, Kec. Citeureup",Bogor,021-8755433,C
RUMAHSAKIT_PT_50K_2023_JAWABARAT.319,POINT (-6.595748452999942 106.80477390000004),1519,RS Umum Siloam Hospitals Bogor,GI01050100,Perusahaan,528c628d-bc92-447d-8d1f-a0e99c7dc40f,SRGI2013,0,"Jl. Pajajaran No. 27 Bogor Tengah, Kota Bogor",Kota Bogor,2518303900,C
RUMAHSAKIT_PT_50K_2023_JAWABARAT.320,POINT (-6.341850008999927 107.09840640000004),1520,RS Umum Dr. Iqbali Taufan,GI01050100,Perorangan,528c628d-bc92-447d-8d1f-a0e99c7dc40f,SRGI2013,0,Villa Mutiara Cikarang 2 Blok. E3 No.16-20 Sukasejati Kec. Cikarang Selatan Kab. Bekasi,Bekasi,(021)8971769,D
RUMAHSAKIT_PT_50K_2023_JAWABARAT.321,POINT (-6.743687378999937 107.44493290000008),1521,RS Umum Daerah Cikalong Wetan,GI01050100,Pemerintah Kabupaten,528c628d-bc92-447d-8d1f-a0e99c7dc40f,SRGI2013,0,Jl. Padalarang - Purwakarta KM 11 Cikalong Wetan,Bandung Barat,022 8686243,C
RUMAHSAKIT_PT_50K_2023_JAWABARAT.322,POINT (-6.462028845999953 107.81260100000009),1522,RS Umum Haji Syaiful Anwar,GI01050100,Swasta / Lainnya,528c628d-bc92-447d-8d1f-a0e99c7dc40f,SRGI2013,0,Jl. Raya Cipunagara RT. 39 RW. 10 Desa Kamarung Kecamatan Pagaden Kabupaten Subang,Subang,81222477888,D
RUMAHSAKIT_PT_50K_2023_JAWABARAT.323,POINT (-6.256811940999967 107.00863860000004),1523,RS Siloam Bekasi Timur,GI01050100,Swasta / Lainnya,528c628d-bc92-447d-8d1f-a0e99c7dc40f,SRGI2013,0,"Jl. Charil Anwar Blu Plaza No 27, RT. 004 RW. 09 Kelurahan Margahayu Kecamatan Bekasi Timur",Kota Bekasi,021 80611900,C
RUMAHSAKIT_PT_50K_2023_JAWABARAT.324,POINT (-6.596678855999926 106.79136610000006),1524,RS Umum Bhayangkara Tk IV Bogor,GI01050100,POLRI,528c628d-bc92-447d-8d1f-a0e99c7dc40f,SRGI2013,0,Jl. Kapten Muslihat No. 18 Paledang Bogor Tengah Kota Bogor,Kota Bogor,2518348987,D
RUMAHSAKIT_PT_50K_2023_JAWABARAT.325,POINT (-6.091544387999932 107.18714600000004),1525,RS Umum Daerah Cabangbungin,GI01050100,Pemerintah Kabupaten,528c628d-bc92-447d-8d1f-a0e99c7dc40f,SRGI2013,0,Jl. Kp. Bojong RT 004/RW 001 Desa Jayalaksana Kecamatan Cabangbungin Kabupaten Bekasi,Bekasi,021 3002 1633,D
RUMAHSAKIT_PT_50K_2023_JAWABARAT.326,POINT (-6.284586875999935 107.17372580000006),1526,RS Umum Permata Keluarga Jababeka,GI01050100,Swasta / Lainnya,528c628d-bc92-447d-8d1f-a0e99c7dc40f,SRGI2013,0,Jl. DR. Cipto Mangunkusumo Blok A Nomor 1 A Medical City Kota Jababeka,Bekasi,021 29083399,C
RUMAHSAKIT_PT_50K_2023_JAWABARAT.327,POINT (-6.313122220999958 107.81944840000006),1527,RS Umum Kharisma,GI01050100,Swasta / Lainnya,528c628d-bc92-447d-8d1f-a0e99c7dc40f,SRGI2013,0,Jl. Warung Cendol RT 10 RW 04 Rancasari Pamanukan Subang,Subang,260550911,D
RUMAHSAKIT_PT_50K_2023_JAWABARAT.328,POINT (-7.295613328999934 108.37040420000005),1528,RS Umum Dadi Keluarga Ciamis,GI01050100,Swasta / Lainnya,528c628d-bc92-447d-8d1f-a0e99c7dc40f,SRGI2013,0,"Jl. RE. Martadinata Nomor 333-335 Baregbeg, Ciamis",Ciamis,0265-2750777,C
RUMAHSAKIT_PT_50K_2023_JAWABARAT.329,POINT (-6.259037065999962 107.01979880000005),1529,RS Primaya,GI01050100,Perusahaan,528c628d-bc92-447d-8d1f-a0e99c7dc40f,SRGI2013,0,Jl. HM. Joyomartono RT 003 RW 021 Kelurahan Margahayu Kecamatan Bekasi Timur Kota Bekasi.,Kota Bekasi,021-8267-9999,B
RUMAHSAKIT_PT_50K_2023_JAWABARAT.330,POINT (-6.5606004959999495 107.74907950000005),1530,RS Khusus Ibu dan Anak Grha Mutiara,GI01050100,Perusahaan,528c628d-bc92-447d-8d1f-a0e99c7dc40f,SRGI2013,0,Jl. Brigjen Katamso No. 4 Subang 41212 Kp. Sukawening RT. 62 RW. 20 Kel. Cigadung,Subang,81222779104,C
RUMAHSAKIT_PT_50K_2023_JAWABARAT.331,POINT (-6.843671146999952 107.48043880000006),1531,RS Ibu dan Anak Kartini,GI01050100,Swasta / Lainnya,528c628d-bc92-447d-8d1f-a0e99c7dc40f,SRGI2013,0,Jl. Letkol GA Manulang No. 46 Padalarang Bandung Barat,Bandung Barat,022-6804440,C
RUMAHSAKIT_PT_50K_2023_JAWABARAT.332,POINT (-6.4811041999999475 106.80535240000006),1532,RS Harapan Sehati,GI01050100,Perusahaan,528c628d-bc92-447d-8d1f-a0e99c7dc40f,SRGI2013,0,Jl. Raya Tegar Beriman Kp. Pondok Manggis RT. 01 RW. 04 Kel. Bojong Baru Kec. Bojong Gede Kab Bogor,Bogor,2187972380,C
RUMAHSAKIT_PT_50K_2023_JAWABARAT.333,POINT (-6.405228009999973 106.81952780000006),1533,RS Umum Alia Hospital,GI01050100,Perusahaan,528c628d-bc92-447d-8d1f-a0e99c7dc40f,SRGI2013,0,Jl. Kartini No. 2 RT. 001 RW. 009 Kelurahan Depok Kecamatan Pancoran Mas,Kota Depok,021 77803600,C
RUMAHSAKIT_PT_50K_2023_JAWABARAT.334,POINT (-6.3084481159999655 107.01647580000008),1534,RS Mustika Medika Bekasi,GI01050100,Perusahaan,528c628d-bc92-447d-8d1f-a0e99c7dc40f,SRGI2013,0,Jalan Kelapa Dua no 110 RT 07 RW 08 Kelurahan Padurenan Kecamatan Mustikajaya Kota Bekasi,Kota Bekasi,2182622530,D
RUMAHSAKIT_PT_50K_2023_JAWABARAT.335,POINT (-6.640893099999971 106.83296130000008),1535,Bogor Senior Hospital,GI01050100,Swasta / Lainnya,528c628d-bc92-447d-8d1f-a0e99c7dc40f,SRGI2013,0,Jl. Raya Tajur No. 168 Muarasari Bogor,Kota Bogor,0251-7556777,D
RUMAHSAKIT_PT_50K_2023_JAWABARAT.336,POINT (-6.90945288599994 107.63888740000004),1536,RS Ibu dan Anak Al Islam,GI01050100,Swasta / Lainnya,528c628d-bc92-447d-8d1f-a0e99c7dc40f,SRGI2013,0,Jl. Awibitung No. 29-31 Kelurahan Cicadas Kecamatan Cibeunying Kidul,Kota Bandung,227208284,C
RUMAHSAKIT_PT_50K_2023_JAWABARAT.337,POINT (-6.974655857999949 108.46780800000005),1537,RS Jantung Hasna Medika Kuningan,GI01050100,Perusahaan,528c628d-bc92-447d-8d1f-a0e99c7dc40f,SRGI2013,0,Jl. Raya Cigugur Lingkungan Manis RT. 030 RW. 011 Kecamatan Cigugur,Kuningan,6.22329E+11,C
RUMAHSAKIT_PT_50K_2023_JAWABARAT.338,POINT (-6.28952013199995 107.08310310000007),1538,RS EMC Cibitung,GI01050100,Swasta / Lainnya,528c628d-bc92-447d-8d1f-a0e99c7dc40f,SRGI2013,0,"Jl. Kalimantan Blok CB No.1 Kawasan Industri MM2100, Gandasari, Cikarang Barat",Bekasi,2150570999,C
RUMAHSAKIT_PT_50K_2023_JAWABARAT.339,POINT (-6.225167471999953 107.16084280000007),1539,RS Cenka,GI01050100,Perorangan,528c628d-bc92-447d-8d1f-a0e99c7dc40f,SRGI2013,0,Jl.Pilar-Sukatani Desa Sukaraya Warung Pojok RT. 05 RW. 06 Kec.Karangbahagia,Bekasi,021 89121188,C
RUMAHSAKIT_PT_50K_2023_JAWABARAT.340,POINT (-6.393130607999979 106.74312950000007),1540,RS Umum Brawijaya Bojongsari,GI01050100,Swasta / Lainnya,528c628d-bc92-447d-8d1f-a0e99c7dc40f,SRGI2013,0,Jl. Raya Parung Ciputat RT 002 RW 002,Kota Depok,29836640,D
RUMAHSAKIT_PT_50K_2023_JAWABARAT.341,POINT (-6.269326618999969 106.98109310000007),1541,RS EMC Pekayon,GI01050100,Swasta / Lainnya,528c628d-bc92-447d-8d1f-a0e99c7dc40f,SRGI2013,0,Jl. Pulo Ribung RT. 001 RW. 021 Kelurahan Pekayon Jaya Kecamatan Bekasi Selatan Kota Bekasi,Kota Bekasi,021 29779999,C
RUMAHSAKIT_PT_50K_2023_JAWABARAT.342,POINT (-6.236029053999971 107.04235610000006),1542,RS Ibu dan Anak Aisyah Qurrataain,GI01050100,Swasta / Lainnya,528c628d-bc92-447d-8d1f-a0e99c7dc40f,SRGI2013,0,Jl. Kampung Rawa Kalong RT. 001 RW. 021 Setia Mekar Tambun Selatan,Bekasi,null,C
RUMAHSAKIT_PT_50K_2023_JAWABARAT.343,POINT (-6.37284700999993 106.82951210000004),1543,RS Universitas Indonesia,GI01050100,Kementerian Lain,528c628d-bc92-447d-8d1f-a0e99c7dc40f,SRGI2013,0,"Jl. Prof. Dr. Bahder Djohan, Kampus Universitas Indonesia Depok",Kota Depok,021-50829292,B
RUMAHSAKIT_PT_50K_2023_JAWABARAT.344,POINT (-6.4954241369999295 108.47431500000005),1544,RS Umum Daerah Mursid Ibnu Syafiuddin,GI01050100,Pemerintah Kabupaten,528c628d-bc92-447d-8d1f-a0e99c7dc40f,SRGI2013,0,Jl. Raya Krangkeng Km. 28 Kecamatan Krangkeng,Indramayu,6.28591E+12,D
RUMAHSAKIT_PT_50K_2023_JAWABARAT.345,POINT (-6.973133257999962 108.58784280000003),1545,RS Mitra Husada Ciawigebang,GI01050100,Perorangan,528c628d-bc92-447d-8d1f-a0e99c7dc40f,SRGI2013,0,Jl Raya Siliwangi No. 151 Ciawigebang,Kuningan,,D
RUMAHSAKIT_PT_50K_2023_JAWABARAT.346,POINT (-6.978270950999956 108.60618580000005),1546,RS Umum Aria Kamuning,GI01050100,Swasta / Lainnya,528c628d-bc92-447d-8d1f-a0e99c7dc40f,SRGI2013,0,Jl. Raya Cihideunggirang Dusun Manis RT 001/RW 002 Desa Cihideunggirang Kec. Cidahu,Kuningan,(0232)891188,D
RUMAHSAKIT_PT_50K_2023_JAWABARAT.347,POINT (-6.44214872699996 107.94574920000008),1547,RS Syahid Al Irsyad,GI01050100,Swasta / Lainnya,528c628d-bc92-447d-8d1f-a0e99c7dc40f,SRGI2013,0,Jl. Jendral Sudirman No. 240 Cipancuh Kec.Haurgeulis - Indramayu,Indramayu,234741065,D
RUMAHSAKIT_PT_50K_2023_JAWABARAT.348,POINT (-6.340487501999974 108.31685810000005),1548,RS Ibu dan Anak Irhamna Indramayu,GI01050100,Swasta / Lainnya,528c628d-bc92-447d-8d1f-a0e99c7dc40f,SRGI2013,0,Jl. Raya Terusan No. 01 Kec. Sindang,Indramayu,234273458,C
RUMAHSAKIT_PT_50K_2023_JAWABARAT.349,POINT (-6.287851735999936 106.95378370000009),1549,RS Mitra Keluarga Pratama,GI01050100,Swasta / Lainnya,528c628d-bc92-447d-8d1f-a0e99c7dc40f,SRGI2013,0,Jl. Raya Jatimekar Kel. Jatimekar Kec. Jatiasih Kota Bekasi,Kota Bekasi,021-85511000,C
RUMAHSAKIT_PT_50K_2023_JAWABARAT.350,POINT (-6.581341993999956 106.81472000000008),1550,RS Ibu dan Anak Nuraida,GI01050100,Swasta / Lainnya,528c628d-bc92-447d-8d1f-a0e99c7dc40f,SRGI2013,0,Jl. Achmad Sobana No. 105 Kelurahan Tegal Gundil Kecamatan Bogor Utara Kota Bogor,Kota Bogor,2518368866,C
RUMAHSAKIT_PT_50K_2023_JAWABARAT.351,POINT (-6.2067997279999645 107.01855520000004),1551,RS Primaya Bekasi Utara,GI01050100,Perusahaan,528c628d-bc92-447d-8d1f-a0e99c7dc40f,SRGI2013,0,Villa Indah Permai Golden City Blok G No. 1 Teluk Pucung Bekasi Utara,Kota Bekasi,888 92 000,C
RUMAHSAKIT_PT_50K_2023_JAWABARAT.352,POINT (-6.179589629999953 107.04072930000007),1552,RS Ananda Babelan,GI01050100,Swasta / Lainnya,528c628d-bc92-447d-8d1f-a0e99c7dc40f,SRGI2013,0,Jl. Raya Babelan KM. 9.6 RT/RW 002/001 Kelurahan Kebalen Kecamatan Babelan,Bekasi,021-8923-4000,C
RUMAHSAKIT_PT_50K_2023_JAWABARAT.353,POINT (-6.460108017999971 108.28486290000006),1553,RS Mitra Plumbon Indramayu,GI01050100,Swasta / Lainnya,528c628d-bc92-447d-8d1f-a0e99c7dc40f,SRGI2013,0,Jl. By Pass Jalan Baru Desa Ujungaris Kec. Widasari Kab. Indramayu,Indramayu,0234-7142333,C
RUMAHSAKIT_PT_50K_2023_JAWABARAT.354,POINT (-6.3632946019999395 106.92159600000008),1554,RS Umum Daerah Kelas D Jatisampurna,GI01050100,Pemerintah Kota,528c628d-bc92-447d-8d1f-a0e99c7dc40f,SRGI2013,0,Jl. Raya Pasar Kranggan No. 26 RT 01 RW 04 Kelurahan Jatisampurna Kecamatan Jatisampurna Kota Bekasi Provinsi Jawa Barat 17433,Kota Bekasi,021-22817282,D
RUMAHSAKIT_PT_50K_2023_JAWABARAT.355,POINT (-6.282732604999978 106.91362110000006),1555,RS Umum Daerah Pondokgede,GI01050100,Pemerintah Kota,528c628d-bc92-447d-8d1f-a0e99c7dc40f,SRGI2013,0,Jl. Raya Jatiwaringin 1 RT 01 RW 11 Kel. Jatiwaringin Kec. Pondok gede,Kota Bekasi,,D
RUMAHSAKIT_PT_50K_2023_JAWABARAT.356,POINT (-6.314446092999958 106.98660350000006),1556,RS Umum Daerah Bantar Gebang,GI01050100,Pemerintah Kota,528c628d-bc92-447d-8d1f-a0e99c7dc40f,SRGI2013,0,Jl. Raya Siliwangi KM 10 Rt 04 Rw 04 Kel. Bantar Gebang Kota Bekasi,Kota Bekasi,,D
RUMAHSAKIT_PT_50K_2023_JAWABARAT.357,POINT (-6.385034108999946 106.95434420000004),1557,RS Eka Hospital,GI01050100,Perusahaan,528c628d-bc92-447d-8d1f-a0e99c7dc40f,SRGI2013,0,"Perum Kota Wisata Kav. V2, Desa Nagrak, Kec. Gunung Putri Kab. Bogor",Bogor,,B
RUMAHSAKIT_PT_50K_2023_JAWABARAT.358,POINT (-7.331475735999959 108.41137800000007),1558,RS Khusus Orthopedi RSOP Ciamis,GI01050100,Swasta / Lainnya,528c628d-bc92-447d-8d1f-a0e99c7dc40f,SRGI2013,0,Jl. Raya Ciamis Banjar KM 7 No. 341 RT 16 RW 06 Desa Cijeungjing Kec Cijeungjing,Ciamis,0265-7600450,C
RUMAHSAKIT_PT_50K_2023_JAWABARAT.359,POINT (-6.159239328999945 106.97361660000007),1559,RS Eka Bekasi,GI01050100,Swasta / Lainnya,528c628d-bc92-447d-8d1f-a0e99c7dc40f,SRGI2013,0,Kota Harapan Indah Blok i2-9 No. 9,Bekasi,,B
RUMAHSAKIT_PT_50K_2023_JAWABARAT.360,POINT (-6.4069715179999776 108.25064870000006),1560,RS Sentra Medika Langut,GI01050100,Swasta / Lainnya,528c628d-bc92-447d-8d1f-a0e99c7dc40f,SRGI2013,0,Jln. Raya Langut No. 100 Desa Langut Kecamatan Lohbener,Indramayu,,D
RUMAHSAKIT_PT_50K_2023_JAWABARAT.361,POINT (-6.380108211999925 106.68902450000007),1561,RS Pena 98,GI01050100,Swasta / Lainnya,528c628d-bc92-447d-8d1f-a0e99c7dc40f,SRGI2013,0,Jl. Pemuda No. 36 RT 001 RW 007 Desa Pengasinan Kecamatan Gunung Sindur Kabupaten Bogor Provinsi Jawa Barat.,Bogor,2175874401,C
RUMAHSAKIT_PT_50K_2023_JAWABARAT.362,POINT (-6.967781659999957 107.82641730000006),1562,RS Umum Daerah Kesehatan Kerja,GI01050100,Pemerintah Provinsi,528c628d-bc92-447d-8d1f-a0e99c7dc40f,SRGI2013,0,Jl. Raya Rancaekek KM. 27 NO. 612 Desa Nanjungmekar Kec. Rancaekek,Bandung,-7798738,D
RUMAHSAKIT_PT_50K_2023_JAWABARAT.363,POINT (-6.765141079999978 108.17777020000005),1563,RS Ibu dan Anak Livasya,GI01050100,Swasta / Lainnya,528c628d-bc92-447d-8d1f-a0e99c7dc40f,SRGI2013,0,Jl. Raya Timur III No. 875 Dawuan,Majalengka,(0233) 662273,C
RUMAHSAKIT_PT_50K_2023_JAWABARAT.364,POINT (-7.681482625999934 108.64654710000008),1564,RS Umum Daerah Pandega Pangandaran,GI01050100,Pemerintah Kabupaten,528c628d-bc92-447d-8d1f-a0e99c7dc40f,SRGI2013,0,Jl. Merdeka No. 412 Desa Pananjung Kec.Pangandaran Kab. Pangandaran,Pangandaran,0265-7503044,C
RUMAHSAKIT_PT_50K_2023_JAWABARAT.365,POINT (-6.3697792079999545 107.52335730000004),1565,RS Khusus Paru Kabupaten Karawang,GI01050100,Pemerintah Kabupaten,528c628d-bc92-447d-8d1f-a0e99c7dc40f,SRGI2013,0,Jl. Raya Jatisari Desa Jatisari Kec. Jatisari,Karawang,0264-8360161,C
RUMAHSAKIT_PT_50K_2023_JAWABARAT.366,POINT (-6.3081714919999285 107.31259830000005),1566,RS Hermina Karawang,GI01050100,Perusahaan,528c628d-bc92-447d-8d1f-a0e99c7dc40f,SRGI2013,0,Jl. Tuparev Sukasari Kel. Karawang Wetan Kec. Karawang Timur Karawang,Karawang,0267-8412525,C
RUMAHSAKIT_PT_50K_2023_JAWABARAT.367,POINT (-6.33053194699994 107.29702960000009),1567,RS Primaya Karawang,GI01050100,Swasta / Lainnya,528c628d-bc92-447d-8d1f-a0e99c7dc40f,SRGI2013,0,"Jl. Arteri Galuh Mas Kav. Komersial Galuh Mas Blok 10, Desa Puseurjaya Kec. Telukjambe Timur",Karawang,0267 8417 000,C
RUMAHSAKIT_PT_50K_2023_JAWABARAT.368,POINT (-6.819266414999959 107.14079020000008),1568,RS Bhayangkara Cianjur,GI01050100,POLRI,528c628d-bc92-447d-8d1f-a0e99c7dc40f,SRGI2013,0,Jl. Suroso No. 21 Kel. Solokpandan Kec. Cianjur Kabupaten Cianjur,Cianjur,,D
RUMAHSAKIT_PT_50K_2023_JAWABARAT.369,POINT (-6.541154254999981 107.44075800000007),1569,RS Ibu dan Anak Bunda Fathia,GI01050100,Perusahaan,528c628d-bc92-447d-8d1f-a0e99c7dc40f,SRGI2013,0,Jl. Ibrahim Singadilaga No. 95-97 Purwakarta,Purwakarta,,C
RUMAHSAKIT_PT_50K_2023_JAWABARAT.370,POINT (-6.716384995999931 108.43588500000004),1570,RS Pasar Minggu Cirebon,GI01050100,Perusahaan,528c628d-bc92-447d-8d1f-a0e99c7dc40f,SRGI2013,0,Jl. Ki Ageng Tepak Desa Semplo Kecamatan Palimanan,Cirebon,0231 8826939,D
RUMAHSAKIT_PT_50K_2023_JAWABARAT.371,POINT (-7.2086744269999485 106.88483340000005),1571,RS Umum Daerah Sagaranten,GI01050100,Pemerintah Kabupaten,528c628d-bc92-447d-8d1f-a0e99c7dc40f,SRGI2013,0,Kp. Cigadog RT. 025 RW. 006 Desa Sagaranten Kec. Sagaranten,Sukabumi,,D
RUMAHSAKIT_PT_50K_2023_JAWABARAT.372,POINT (-6.84454756699995 107.48642860000007),1572,RS Ibu dan Anak Graha Medika Padalarang,GI01050100,Perusahaan,528c628d-bc92-447d-8d1f-a0e99c7dc40f,SRGI2013,0,Jl. Raya Padalarang Ruko Padalarang Point No. 527,Bandung Barat,2287785998,C
RUMAHSAKIT_PT_50K_2023_JAWABARAT.373,POINT (-7.1764736399999265 107.57278770000005),1573,RS Umum Karya Pangalengan Bhakti Sehat,GI01050100,Swasta / Lainnya,528c628d-bc92-447d-8d1f-a0e99c7dc40f,SRGI2013,0,Jl. Raya Pangalengan No. 340 Pangalengan,Bandung,2245335812,D
RUMAHSAKIT_PT_50K_2023_JAWABARAT.374,POINT (-6.977208254999937 108.50190970000006),1574,RS Permata Kuningan,GI01050100,Perusahaan,528c628d-bc92-447d-8d1f-a0e99c7dc40f,SRGI2013,0,Jl. Cut Nyak Dien RT. 007 RW. 002 45513,Kuningan,0232 8905556,C
RUMAHSAKIT_PT_50K_2023_JAWABARAT.375,POINT (-7.366440306999948 108.63960890000004),1575,RS Umum Daerah Asih Husada Lengensari,GI01050100,Pemerintah Kota,528c628d-bc92-447d-8d1f-a0e99c7dc40f,SRGI2013,0,Jl. Pahlawan No. 25 Lingk. Babakan Kel. Muktisari Kec. Langnsari,Kota Banjar,,D
RUMAHSAKIT_PT_50K_2023_JAWABARAT.376,POINT (-6.891137927999978 107.53697960000005),1576,RS Umum Baros,GI01050100,Perusahaan,528c628d-bc92-447d-8d1f-a0e99c7dc40f,SRGI2013,0,Jl. Raya Baros E46 RT. 01 RW. 15 Kel. Baros Kec. Cimahi Tengah,Kota Cimahi,,D
RUMAHSAKIT_PT_50K_2023_JAWABARAT.377,POINT (-6.321921058999976 107.29159970000006),1577,RS Permata Keluarga Karawang,GI01050100,Swasta / Lainnya,528c628d-bc92-447d-8d1f-a0e99c7dc40f,SRGI2013,0,Jl Raya Galuh Mas Blok VI A No 1,Karawang,6.22676E+11,C
RUMAHSAKIT_PT_50K_2023_JAWABARAT.378,POINT (-6.918458249999958 106.95782530000008),1578,RS Primaya Sukabumi,GI01050100,Swasta / Lainnya,528c628d-bc92-447d-8d1f-a0e99c7dc40f,SRGI2013,0,Jl. RA Kosasih No. 45 Kel. Sukaraja Kec. Sukaraja,Sukabumi,,C
RUMAHSAKIT_PT_50K_2023_JAWABARAT.379,POINT (-7.180299060999971 107.97722170000009),1579,RS Medina,GI01050100,Perusahaan,528c628d-bc92-447d-8d1f-a0e99c7dc40f,SRGI2013,0,Jl. Raya Wanaraja No. 500 RT. 004 RW. 008 Desa Cinunuk Kec. Wanaraja,Garut,,D
RUMAHSAKIT_PT_50K_2023_JAWABARAT.380,POINT (-6.2542031649999785 107.11508710000004),1580,RS Hermina Metland Cibitung,GI01050100,Perusahaan,528c628d-bc92-447d-8d1f-a0e99c7dc40f,SRGI2013,0,Perumahan Metland Cibitung,Bekasi,,C
RUMAHSAKIT_PT_50K_2023_JAWABARAT.381,POINT (-6.897058730999959 107.63468100000006),1581,RS Kartini,GI01050100,Swasta / Lainnya,528c628d-bc92-447d-8d1f-a0e99c7dc40f,SRGI2013,0,Jl. Pahlawan No. 48 Neglasari Cibeunying,Kota Bandung,,D
RUMAHSAKIT_PT_50K_2023_JAWABARAT.382,POINT (-7.172118999999952 108.36826910000008),1582,RS Umum Daerah Kawali,GI01050100,Pemerintah Kabupaten,528c628d-bc92-447d-8d1f-a0e99c7dc40f,SRGI2013,0,Jl. Raya Kawali Cirebon No. 37 Desa Winduraja Kec. Kawali 46253,Ciamis,0265-7511923,D
RUMAHSAKIT_PT_50K_2023_JAWABARAT.383,POINT (-6.210369152999931 107.02780780000006),1583,RS umum Daerah Teluk Pucung,GI01050100,Pemerintah Kota,528c628d-bc92-447d-8d1f-a0e99c7dc40f,SRGI2013,0,Jl. Lingkar Utara Kel. Teluk Pucung Kec. Bekasi Utara,Kota Bekasi,,D
RUMAHSAKIT_PT_50K_2023_JAWABARAT.384,POINT (-6.502023638999958 107.58035140000004),1584,RS Indo Sehat 2003,GI01050100,Swasta / Lainnya,528c628d-bc92-447d-8d1f-a0e99c7dc40f,SRGI2013,0,Jl. Raya Subang Sadang KM 28 Kp. Tegal Garu RT. 12 RW. 04 Kec. Cipeundeuy,Subang,,D
RUMAHSAKIT_PT_50K_2023_JAWABARAT.385,POINT (-6.257117242999925 107.08064460000008),1585,RS Permata Bunda,GI01050100,Perusahaan,528c628d-bc92-447d-8d1f-a0e99c7dc40f,SRGI2013,0,"Blok C1 Jl. Gramapuri I No.8 - 10, Wanasari, Cibitung, Bekasi Regency, Jawa Barat koden pos 17520",Bekasi,085284274455_,C
RUMAHSAKIT_PT_50K_2023_JAWABARAT.386,POINT (-6.2434165019999455 107.15252480000004),1586,RS Umum dr. Abdul Radjak Cibitung,GI01050100,Perusahaan,528c628d-bc92-447d-8d1f-a0e99c7dc40f,SRGI2013,0,"Jl. Al-Huda, Cikarang Jati NO 61, RT.02 RW.02 Desa Sukajaya",Bekasi,021-89073730,D
RUMAHSAKIT_PT_50K_2023_JAWABARAT.387,POINT (-6.945567258999972 107.64052350000009),1587,RS Jantung dan Pembuluh Darah Paramarta,GI01050100,Perusahaan,528c628d-bc92-447d-8d1f-a0e99c7dc40f,SRGI2013,0,Jl. Soekarno Hatta No. 581 Bandung 42075,Kota Bandung,(022) 7337239,C
RUMAHSAKIT_PT_50K_2023_JAWABARAT.388,POINT (-7.0317604639999445 107.52680410000005),1588,RS Hermina Soreang,GI01050100,Swasta / Lainnya,528c628d-bc92-447d-8d1f-a0e99c7dc40f,SRGI2013,0,"Jl. Terusan Al Fathu No.9A, Sarilamping, Soreang, Kec. Soreang, Kabupaten Bandung, Jawa Barat 40911",Bandung,(022) 5892525,C
RUMAHSAKIT_PT_50K_2023_JAWABARAT.389,POINT (-6.494872020999935 107.59707230000004),1589,RS Rayhan,GI01050100,Swasta / Lainnya,528c628d-bc92-447d-8d1f-a0e99c7dc40f,SRGI2013,0,Jl. Raya Sadang - Subang KM 17,Subang,081809414667_,C
