FID,geom,OBJECTID,NAMOBJ,FCODE,REMARK,METADATA,SRS_ID,JPLYRS,RSALAMAT,WADMKK,TELEPON,TIPRST
RUMAHSAKIT_PT_50K_2023_JAWABARAT.198,POINT (-6.943604154999946 107.45970430000006),1398,RS Umum Daerah Cililin,GI01050100,Pemerintah Kabupaten,528c628d-bc92-447d-8d1f-a0e99c7dc40f,SRGI2013,0,Jl. Cililin Blok Cinta Karya Desa Cililin Kecamatan Cililin Kabupaten Bandung Barat,Bandung Barat,022-6941600,C
RUMAHSAKIT_PT_50K_2023_JAWABARAT.199,POINT (-6.39315493099997 106.77118100000007),1399,RS Ibu dan Anak Asyifa Depok,GI01050100,Perusahaan,528c628d-bc92-447d-8d1f-a0e99c7dc40f,SRGI2013,0,"Jl.Raya Depok - Cinere No 09, Rkp. Jaya Baru, Depok",Kota Depok,021-77883905,C
RUMAHSAKIT_PT_50K_2023_JAWABARAT.200,POINT (-6.247058186999936 106.98383890000008),1400,RS Primaya,GI01050100,Perusahaan,528c628d-bc92-447d-8d1f-a0e99c7dc40f,SRGI2013,0,"Jl. KH. Noer Alie Kav. 17-18 (Kalimalang), Kel. Kayuringin Jaya, Kec. Bekasi Selatan",Kota Bekasi,021-8267-9999,B
RUMAHSAKIT_PT_50K_2023_JAWABARAT.201,POINT (-6.291967640999928 107.15125690000008),1401,RS Umum Mitra Keluarga Cikarang,GI01050100,Perusahaan,528c628d-bc92-447d-8d1f-a0e99c7dc40f,SRGI2013,0,"Jl. Industri Raya 100, Lemah Abang",Bekasi,021-89840900,B
RUMAHSAKIT_PT_50K_2023_JAWABARAT.202,POINT (-6.352008904999934 107.37787660000004),1402,RS Umum Fikri Medika,GI01050100,Perusahaan,528c628d-bc92-447d-8d1f-a0e99c7dc40f,SRGI2013,0,Jl. Raya Kosambi - Telagasari KM 03 Klari Karawang,Karawang,(0267) 861 5555,C
RUMAHSAKIT_PT_50K_2023_JAWABARAT.203,POINT (-6.495094901999948 106.75113170000009),1403,RS Sentosa,GI01050100,Perusahaan,528c628d-bc92-447d-8d1f-a0e99c7dc40f,SRGI2013,0,Jl. Raya Kemang No. 18 Desa Pondok Udik Kec. Kemang Kab. Bogor,Bogor,0251 - 7541900,C
RUMAHSAKIT_PT_50K_2023_JAWABARAT.204,POINT (-6.268624815999942 106.97219870000004),1404,RS Umum Hermina Galaxy,GI01050100,Perusahaan,528c628d-bc92-447d-8d1f-a0e99c7dc40f,SRGI2013,0,jl. Gardenia Raya Blok BA I No.11 Grand Galaxy City Bekasi,Kota Bekasi,021-8222525,C
RUMAHSAKIT_PT_50K_2023_JAWABARAT.205,POINT (-7.322719924999944 108.21479820000008),1405,RS Umum Syifa Medina,GI01050100,Swasta / Lainnya,528c628d-bc92-447d-8d1f-a0e99c7dc40f,SRGI2013,0,Jl. Bantar No. 15A Cihideung Kota Tasikmalaya,Kota Tasikmalaya,0265 - 334544,D
RUMAHSAKIT_PT_50K_2023_JAWABARAT.206,POINT (-6.371357499999931 107.52110620000008),1406,RS Umum Puri Asih,GI01050100,Perusahaan,528c628d-bc92-447d-8d1f-a0e99c7dc40f,SRGI2013,0,Jl. Raya Jatisari No. 3 Jatisari Karawang,Karawang,0264 361459,C
RUMAHSAKIT_PT_50K_2023_JAWABARAT.207,POINT (-6.9118490339999425 106.92271140000008),1407,RS Umum Bhayangkara Setukpa Lemdikpol,GI01050100,POLRI,528c628d-bc92-447d-8d1f-a0e99c7dc40f,SRGI2013,0,Jl. Aminta Azmali No. 59A Kota Sukabumi,Kota Sukabumi,0266-229207,C
RUMAHSAKIT_PT_50K_2023_JAWABARAT.208,POINT (-6.432804509999926 107.04866560000005),1408,RS Umum Daerah Cileungsi,GI01050100,Pemerintah Kabupaten,528c628d-bc92-447d-8d1f-a0e99c7dc40f,SRGI2013,0,"Jl. Raya Cileungsi - Jonggol KM. 10 Cipeucang, Kecamatan Cileungsi",Bogor,(021) 89934667,B
RUMAHSAKIT_PT_50K_2023_JAWABARAT.209,POINT (-6.499621354999931 107.47141830000004),1409,RS Umum dr. Abdul Radjak Purwakarta,GI01050100,Perusahaan,528c628d-bc92-447d-8d1f-a0e99c7dc40f,SRGI2013,0,Jl. Raya Bungur Sari No. 36 Purwakarta,Purwakarta,2648222222,B
RUMAHSAKIT_PT_50K_2023_JAWABARAT.210,POINT (-6.513768050999943 107.45448790000006),1410,RS Umum Asri Purwakarta,GI01050100,Perusahaan,528c628d-bc92-447d-8d1f-a0e99c7dc40f,SRGI2013,0,Jl. Veteran No. 15,Purwakarta,0264-211680,C
RUMAHSAKIT_PT_50K_2023_JAWABARAT.211,POINT (-6.512752657999954 107.47442660000007),1411,RS Umum Rama Hadi,GI01050100,Perusahaan,528c628d-bc92-447d-8d1f-a0e99c7dc40f,SRGI2013,0,Jl.Raya Sadang - Subang RT 17/04 Desa Ciwangi Kec. Bungursari Kab. Purwakarta,Purwakarta,0264-202136,C
RUMAHSAKIT_PT_50K_2023_JAWABARAT.212,POINT (-6.180468592999944 106.99588230000006),1412,RS Ibu dan Anak Taman Harapan Baru,GI01050100,Perusahaan,528c628d-bc92-447d-8d1f-a0e99c7dc40f,SRGI2013,0,"Jln. Taman Harapan Baru Raya, Blok R1, No. 20",Kota Bekasi,(021)-888 71202,C
RUMAHSAKIT_PT_50K_2023_JAWABARAT.213,POINT (-7.651673091999953 107.74716310000008),1413,RS Umum Daerah Pameungpeuk Prov. Jabar,GI01050100,Pemerintah Provinsi,528c628d-bc92-447d-8d1f-a0e99c7dc40f,SRGI2013,0,Jl. Raya Miramareu No 99 Desa Sirnabakti Kec. Pameungpeuk,Garut,0262-2816017,C
RUMAHSAKIT_PT_50K_2023_JAWABARAT.214,POINT (-6.528169669999954 107.45711710000006),1414,RS Umum Amira,GI01050100,Perusahaan,528c628d-bc92-447d-8d1f-a0e99c7dc40f,SRGI2013,0,Jl. Ipik Gandamanah RT 35 / 03 Munjul Jaya Kab. Purwakarta,Purwakarta,(0264) 8221191,C
RUMAHSAKIT_PT_50K_2023_JAWABARAT.215,POINT (-6.277049097999964 107.18122650000004),1415,RS Umum Asri Medika,GI01050100,Perusahaan,528c628d-bc92-447d-8d1f-a0e99c7dc40f,SRGI2013,0,"Jl. Citanduy Raya L 11 No 1, Simpangan, Cikarang Utara, Kab Bekasi, Jawa Barat",Bekasi,021-89142968-69,D
RUMAHSAKIT_PT_50K_2023_JAWABARAT.216,POINT (-6.326894277999941 107.12471230000006),1416,RS Ibu dan Anak Nurul Annisa,GI01050100,Swasta / Lainnya,528c628d-bc92-447d-8d1f-a0e99c7dc40f,SRGI2013,0,Jl. Raya Cibarusah Rt 004/003 Desa Sukaresmi Kec. Cikarang Selatan,Bekasi,021-8971122,D
RUMAHSAKIT_PT_50K_2023_JAWABARAT.217,POINT (-6.940542949999951 107.66401910000008),1417,RS Umum Humana Prima,GI01050100,Swasta / Lainnya,528c628d-bc92-447d-8d1f-a0e99c7dc40f,SRGI2013,0,Jl. Rancabolang No. 21 Kel. Manjahlega Kec. Rancasari Kota Bandung,Kota Bandung,(022)7563489,C
RUMAHSAKIT_PT_50K_2023_JAWABARAT.218,POINT (-6.6531465029999595 107.38977460000007),1418,RS Ibu dan Anak Dian,GI01050100,Perusahaan,528c628d-bc92-447d-8d1f-a0e99c7dc40f,SRGI2013,0,Jl. Raya Cibogo Hilir Kec. Plered Kab. Purwakarta,Purwakarta,(0264) 8316669,C
RUMAHSAKIT_PT_50K_2023_JAWABARAT.219,POINT (-6.614984926999966 107.49452710000008),1419,RS Umum Holistic Purwakarta,GI01050100,Perusahaan,528c628d-bc92-447d-8d1f-a0e99c7dc40f,SRGI2013,0,"Jl. Terusan Kapten Halim KM.09 Salamulya, Pondoksalam, Purwakarta",Purwakarta,(0264) 8223434,C
RUMAHSAKIT_PT_50K_2023_JAWABARAT.220,POINT (-6.325820259999944 107.08610660000005),1420,RS Mitra Medika Narom,GI01050100,Swasta / Lainnya,528c628d-bc92-447d-8d1f-a0e99c7dc40f,SRGI2013,0,Jl. Desa Jatiwangi Cikedokan Kp. Kamurang,Bekasi,021-89983741,C
RUMAHSAKIT_PT_50K_2023_JAWABARAT.221,POINT (-6.331405877999941 107.04842130000009),1421,RS Uni Medika Setu Bekasi,GI01050100,Perusahaan,528c628d-bc92-447d-8d1f-a0e99c7dc40f,SRGI2013,0,Jl. Raya setu No.99 Desa Lubang Buaya Kec. Setu,Bekasi,021-82592888,C
RUMAHSAKIT_PT_50K_2023_JAWABARAT.222,POINT (-6.75680650399994 108.46916350000004),1422,RS Umum Sumber Hurip,GI01050100,Swasta / Lainnya,528c628d-bc92-447d-8d1f-a0e99c7dc40f,SRGI2013,0,"Jl. Rd. Dewi Sartika No. 15 Kel. Tukmudal, Kecamatan Sumber, Kabupaten Cirebon, Provinsi Jawa Barat",Cirebon,,C
RUMAHSAKIT_PT_50K_2023_JAWABARAT.223,POINT (-6.803111985999976 108.61572240000004),1423,RS Umum Universitas Muhammadiyah Cirebon,GI01050100,Organisasi Islam,528c628d-bc92-447d-8d1f-a0e99c7dc40f,SRGI2013,0,"Jl. KH. Wahid Hasyim No. 8 Desa Mertapeda Wetan, Kec. Astanajapura",Cirebon,(0231) 638000,C
RUMAHSAKIT_PT_50K_2023_JAWABARAT.224,POINT (-6.222822171999951 107.02215000000007),1424,RS Umum Anna Medika,GI01050100,Perusahaan,528c628d-bc92-447d-8d1f-a0e99c7dc40f,SRGI2013,0,"Jl. Raya Perjuangan no. 45 Harapan Baru, Bekasi Utara",Kota Bekasi,021-88882211,C
RUMAHSAKIT_PT_50K_2023_JAWABARAT.225,POINT (-6.370218999999963 106.81380570000005),1425,RS Umum Grha Permata Ibu,GI01050100,Perusahaan,528c628d-bc92-447d-8d1f-a0e99c7dc40f,SRGI2013,0,Jl. KH. M. Usman No 168 Kukusan Depok,Kota Depok,021 7778899,C
RUMAHSAKIT_PT_50K_2023_JAWABARAT.226,POINT (-6.5710387589999755 106.73938690000006),1426,RS Umum Medika Dramaga,GI01050100,Perusahaan,528c628d-bc92-447d-8d1f-a0e99c7dc40f,SRGI2013,0,"Jl. Raya Dramaga Km.7,3 Margajaya-Bogor Barat-Kota Bogor",Kota Bogor,0251-8308900,C
RUMAHSAKIT_PT_50K_2023_JAWABARAT.227,POINT (-6.40509622899998 106.97668180000005),1427,RS Umum Hermina Mekarsari,GI01050100,Perusahaan,528c628d-bc92-447d-8d1f-a0e99c7dc40f,SRGI2013,0,Jl Raya Cileungsi Jonggol Km 1 Cileungsi Kab Bogor,Bogor,021-29232525,C
RUMAHSAKIT_PT_50K_2023_JAWABARAT.228,POINT (-6.204432340999972 106.98863080000007),1428,RS Ibu dan Anak Rinova Intan,GI01050100,Perusahaan,528c628d-bc92-447d-8d1f-a0e99c7dc40f,SRGI2013,0,Jl. Raya Seroja No. 101 Harapan Jaya,Kota Bekasi,021-8849401,C
RUMAHSAKIT_PT_50K_2023_JAWABARAT.229,POINT (-6.504100059999928 107.49092440000004),1429,RS Umum Bhakti Husada II Purwakarta,GI01050100,Perusahaan,528c628d-bc92-447d-8d1f-a0e99c7dc40f,SRGI2013,0,Jl. Raya Sadang-Subang KM 5 RT 01/01 Cikumpay Campaka Purwakarta,Purwakarta,0264-8225344,C
RUMAHSAKIT_PT_50K_2023_JAWABARAT.230,POINT (-6.499931860999936 106.84344310000006),1430,RS Ibu dan Anak Assalam,GI01050100,Perusahaan,528c628d-bc92-447d-8d1f-a0e99c7dc40f,SRGI2013,0,"Jl. Raya Bogor KM 46,7 Nanggewer Mekar Cibinong Bogor",Bogor,(021)8753724,C
RUMAHSAKIT_PT_50K_2023_JAWABARAT.231,POINT (-7.370785354999953 108.53801770000007),1431,RS Umum Mitra Idaman,GI01050100,Perusahaan,528c628d-bc92-447d-8d1f-a0e99c7dc40f,SRGI2013,0,Jl. Sudiro W No.57 Kota Banjar,Kota Banjar,(0265) 742175,D
RUMAHSAKIT_PT_50K_2023_JAWABARAT.232,POINT (-7.360999277999952 108.53520730000008),1432,RS Umum Banjar Patroman,GI01050100,Perusahaan,528c628d-bc92-447d-8d1f-a0e99c7dc40f,SRGI2013,0,Jl. Stadion Patroman Kav. III No. 3 Kota Banjar,Kota Banjar,0265 - 2732 532,D
RUMAHSAKIT_PT_50K_2023_JAWABARAT.233,POINT (-6.92172504499996 107.55570960000006),1433,RS Umum Avisena,GI01050100,Perusahaan,528c628d-bc92-447d-8d1f-a0e99c7dc40f,SRGI2013,0,Jl. Melong 170 Kelurahan. Melong Kecamatan. Cimahi Selatan,Kota Cimahi,(022) 6062582,C
RUMAHSAKIT_PT_50K_2023_JAWABARAT.234,POINT (-6.2527254129999505 107.08620180000008),1434,RS Umum Cibitung Medika,GI01050100,Perusahaan,528c628d-bc92-447d-8d1f-a0e99c7dc40f,SRGI2013,0,Jl. H. Bosih No.117 Cibitung Kabupaten Bekasi,Bekasi,021-88323444,C
RUMAHSAKIT_PT_50K_2023_JAWABARAT.235,POINT (-6.472054258999947 107.81097090000009),1435,RS Umum Mutiara Hati,GI01050100,Swasta / Lainnya,528c628d-bc92-447d-8d1f-a0e99c7dc40f,SRGI2013,0,Jl. Raya Pagaden Rt 15/04 Desa Sukamulya Kec.Pagaden Subang,Subang,(0260) 451828,C
RUMAHSAKIT_PT_50K_2023_JAWABARAT.236,POINT (-6.706819975999963 108.43347130000006),1436,RS Umum Khalishah,GI01050100,Swasta / Lainnya,528c628d-bc92-447d-8d1f-a0e99c7dc40f,SRGI2013,0,Jl. Dr. Setia Budi No.8 Desa Pegagan Palimanan,Cirebon,0231-342440,C
RUMAHSAKIT_PT_50K_2023_JAWABARAT.237,POINT (-6.176374626999973 106.99860770000004),1437,RS Umum Taman Harapan Baru,GI01050100,Perusahaan,528c628d-bc92-447d-8d1f-a0e99c7dc40f,SRGI2013,0,Jl. Kaliabang Tengah No. 2,Kota Bekasi,021 88981055,C
RUMAHSAKIT_PT_50K_2023_JAWABARAT.238,POINT (-6.899844811999969 107.54716360000003),1438,RS Umum Kasih Bunda,GI01050100,Perusahaan,528c628d-bc92-447d-8d1f-a0e99c7dc40f,SRGI2013,0,Jl. Mahar Martanegara No.166 Kel. Baros Kec. Cimahi Tengah,Kota Cimahi,(022) 6614221,C
RUMAHSAKIT_PT_50K_2023_JAWABARAT.239,POINT (-6.315411285999971 107.29414810000009),1439,RS Umum Mitra Family,GI01050100,Perusahaan,528c628d-bc92-447d-8d1f-a0e99c7dc40f,SRGI2013,0,"Jl. Raya Galuh Mas RT/RW 002/005, Desa Sukaharja, Kecamatan Teluk Jambe Timur",Karawang,0267-8458327,C
RUMAHSAKIT_PT_50K_2023_JAWABARAT.240,POINT (-6.627481154999941 106.82389710000007),1440,RS Umum Juliana,GI01050100,Swasta / Lainnya,528c628d-bc92-447d-8d1f-a0e99c7dc40f,SRGI2013,0,Jl. Raya Tajur No. 75 Bogor Timur Kota Bogor,Kota Bogor,0251-8339593,C
RUMAHSAKIT_PT_50K_2023_JAWABARAT.241,POINT (-6.608472129999939 106.79454780000003),1441,RS Umum Ummi,GI01050100,Perusahaan,528c628d-bc92-447d-8d1f-a0e99c7dc40f,SRGI2013,0,Jl. Empang II No. 2 Bogor Selatan Kota Bogor,Kota Bogor,0251-8341600,C
RUMAHSAKIT_PT_50K_2023_JAWABARAT.242,POINT (-6.368254504999925 106.86043950000004),1442,RS Ibu dan Anak Setya Bhakti,GI01050100,Perusahaan,528c628d-bc92-447d-8d1f-a0e99c7dc40f,SRGI2013,0,Jl. Raya Bogor KM.30 Kel. Mekarsari Kec. Cimanggis,Kota Depok,021-8711518,C
RUMAHSAKIT_PT_50K_2023_JAWABARAT.243,POINT (-6.299148788999958 107.16734460000004),1443,RS Umum Metro Hospitals,GI01050100,Perusahaan,528c628d-bc92-447d-8d1f-a0e99c7dc40f,SRGI2013,0,Jl.Anggrek I B2/2 RT 01/11 Kec Mekar Mukti,Bekasi,(021)89835223,C
RUMAHSAKIT_PT_50K_2023_JAWABARAT.244,POINT (-6.2381927329999485 107.06298870000006),1444,RS Cahaya Medika,GI01050100,Perusahaan,528c628d-bc92-447d-8d1f-a0e99c7dc40f,SRGI2013,0,Kampung Kebon RT. 002 RW. 01 Desa Jejalen Kec. Tambun Utara,Bekasi,021-22137302,D
RUMAHSAKIT_PT_50K_2023_JAWABARAT.245,POINT (-6.43402554599993 107.06922070000007),1445,RS Umum Harapan Mulia,GI01050100,Swasta / Lainnya,528c628d-bc92-447d-8d1f-a0e99c7dc40f,SRGI2013,0,"Jl. Raya Cibarusah No. 5 Kebon Kopi Cibarusah Kelurahan Cibarusah Jaya, Kecamatan Cibarusah, Kabupaten Bekasi, Jawa Barat",Bekasi,021-89952340,C
RUMAHSAKIT_PT_50K_2023_JAWABARAT.246,POINT (-6.309136635999948 107.82180610000006),1446,RS Umum Pamanukan Medical Center (PMC),GI01050100,Perusahaan,528c628d-bc92-447d-8d1f-a0e99c7dc40f,SRGI2013,0,"Jl. Raya Rancasari KM 4,35 Rt 10/Rw 04 Ds.Rancasari Kec.Pamanukan Kab.Subang",Subang,0260-540033,C
RUMAHSAKIT_PT_50K_2023_JAWABARAT.247,POINT (-6.25192369399997 107.14509960000004),1447,RS Umum Cikarang Medika,GI01050100,Swasta / Lainnya,528c628d-bc92-447d-8d1f-a0e99c7dc40f,SRGI2013,0,Jl. KH. Fudholi No. 78 Cikarang Utara,Bekasi,021-29568832,C
RUMAHSAKIT_PT_50K_2023_JAWABARAT.248,POINT (-6.339826266999978 107.03880950000007),1448,RS Umum Kartika Husada Setu,GI01050100,Perusahaan,528c628d-bc92-447d-8d1f-a0e99c7dc40f,SRGI2013,0,Jl. Raya Burangkeng Desa Burangkeng Rt. 001 Rw.06 Kec. Setu,Bekasi,021.82610003-4,C
RUMAHSAKIT_PT_50K_2023_JAWABARAT.249,POINT (-6.261510704999978 107.14677920000008),1449,RS Umum Amanda,GI01050100,Perusahaan,528c628d-bc92-447d-8d1f-a0e99c7dc40f,SRGI2013,0,Jl. Raya Industri No. 36 Cikarang Utara,Bekasi,021-8900277,C
RUMAHSAKIT_PT_50K_2023_JAWABARAT.250,POINT (-6.269386721999979 107.12096080000003),1450,RS Umum Ridhoka Salma,GI01050100,Swasta / Lainnya,528c628d-bc92-447d-8d1f-a0e99c7dc40f,SRGI2013,0,Jl. Raya Imam Bonjol No 7 Cikarang Barat,Bekasi,021-89116527,C
RUMAHSAKIT_PT_50K_2023_JAWABARAT.251,POINT (-6.331220710999958 107.14344980000004),1451,RS Umum Permata Keluarga Lippo Cikarang,GI01050100,Swasta / Lainnya,528c628d-bc92-447d-8d1f-a0e99c7dc40f,SRGI2013,0,"Jl. M.H Thamrin Kav. 129 Lippo Cikarang, Desa CIbatu, Kecamatan Cikarang Selatan Kabupaten Bekasi",Bekasi,,C
RUMAHSAKIT_PT_50K_2023_JAWABARAT.252,POINT (-6.191682066999931 107.03815090000006),1452,RS Umum Tiara,GI01050100,Perusahaan,528c628d-bc92-447d-8d1f-a0e99c7dc40f,SRGI2013,0,Jl. Raya Babelan No. 73 Desa Kebalen Kec. Babelan Kab. Bekasi,Bekasi,021 89131111,C
RUMAHSAKIT_PT_50K_2023_JAWABARAT.253,POINT (-6.267741824999973 107.24951890000006),1453,RS Umum As-Shofwan,GI01050100,Swasta / Lainnya,528c628d-bc92-447d-8d1f-a0e99c7dc40f,SRGI2013,0,"Jl. Raya Karawang - Bekasi km.30 Ds. Bojongsari, Kec. Kedungwaringin.",Bekasi,021-89141890,D
RUMAHSAKIT_PT_50K_2023_JAWABARAT.254,POINT (-6.98352162599997 107.56396120000005),1454,RS Umum TNI AU Lanud Sulaiman,GI01050100,TNI AU,528c628d-bc92-447d-8d1f-a0e99c7dc40f,SRGI2013,0,"JL. Terusan Kopo KM. 10 NO. 457, Kelurahan Sulaiman, Kecamatan Margahayu, Kabupaten Bandung",Bandung,225409608,D
RUMAHSAKIT_PT_50K_2023_JAWABARAT.255,POINT (-6.407568553999965 107.09398460000006),1455,RS Umum Medirossa 2,GI01050100,Perusahaan,528c628d-bc92-447d-8d1f-a0e99c7dc40f,SRGI2013,0,"Jl. Raya Cibarusah, Ds Sindang Mulya No. 5 Cibarusah",Bekasi,021-89955555,C
RUMAHSAKIT_PT_50K_2023_JAWABARAT.256,POINT (-6.276672997999981 107.01979630000005),1456,RS Umum Puspa Husada,GI01050100,Swasta / Lainnya,528c628d-bc92-447d-8d1f-a0e99c7dc40f,SRGI2013,0,Jl. Raya Pondok Timur KM. 1,Bekasi,021-82618978-79,D
RUMAHSAKIT_PT_50K_2023_JAWABARAT.257,POINT (-6.412639949999971 107.46461930000004),1457,RS Umum Helsa,GI01050100,Perusahaan,528c628d-bc92-447d-8d1f-a0e99c7dc40f,SRGI2013,0,Jln. Ir. H. Juanda No 123 Cikampek Karawang,Karawang,0264-8385999,C
RUMAHSAKIT_PT_50K_2023_JAWABARAT.258,POINT (-6.402578825999967 107.44925960000006),1458,RS Ibu dan Anak Sentul,GI01050100,Perusahaan,528c628d-bc92-447d-8d1f-a0e99c7dc40f,SRGI2013,0,Jl. A. Yani No 16 Sentul Cikampek Karawang,Karawang,0264 8386671,C
RUMAHSAKIT_PT_50K_2023_JAWABARAT.259,POINT (-6.321774510999944 106.78361090000004),1459,RS Jantung Diagram,GI01050100,Perusahaan,528c628d-bc92-447d-8d1f-a0e99c7dc40f,SRGI2013,0,Jl. Cinere Raya No.19,Kota Depok,021-50900100,B
RUMAHSAKIT_PT_50K_2023_JAWABARAT.260,POINT (-6.40986122299995 106.96094730000004),1460,RS Ibu dan Anak Kenari Graha Medika,GI01050100,Swasta / Lainnya,528c628d-bc92-447d-8d1f-a0e99c7dc40f,SRGI2013,0,Griya Kenari Mas Blok B2 Cileungsi Bogor,Bogor,021-8230426,C
RUMAHSAKIT_PT_50K_2023_JAWABARAT.261,POINT (-6.294069873999945 106.96327850000006),1461,RS Umum Kartika Husada,GI01050100,Swasta / Lainnya,528c628d-bc92-447d-8d1f-a0e99c7dc40f,SRGI2013,0,Jl. Swatantra no. 72 Jatiasih Bekasi,Kota Bekasi,021-82435587,C
RUMAHSAKIT_PT_50K_2023_JAWABARAT.262,POINT (-6.708943659999932 108.43353140000005),1462,RS Jantung Hasna Medika,GI01050100,Swasta / Lainnya,528c628d-bc92-447d-8d1f-a0e99c7dc40f,SRGI2013,0,"Jl. Raden Gilap No 8 Palimanan, Kabupaten Cirebon",Cirebon,0231 343405,B
RUMAHSAKIT_PT_50K_2023_JAWABARAT.263,POINT (-6.334547615999952 107.27324300000004),1463,RS Umum Rosela,GI01050100,Perusahaan,528c628d-bc92-447d-8d1f-a0e99c7dc40f,SRGI2013,0,Jl. Interchange Tol Karawang Barat No.3 Karawang,Karawang,0267 8637207,D
RUMAHSAKIT_PT_50K_2023_JAWABARAT.264,POINT (-6.341883512999971 107.11904200000004),1464,RS Ibu dan Anak Gizar,GI01050100,Perusahaan,528c628d-bc92-447d-8d1f-a0e99c7dc40f,SRGI2013,0,Jl. Villa Mutiara Cikarang Ruko Pasadena,Bekasi,(021) 89677240,C
RUMAHSAKIT_PT_50K_2023_JAWABARAT.265,POINT (-6.401717503999976 106.77051990000007),1465,RS Umum Permata Depok,GI01050100,Perusahaan,528c628d-bc92-447d-8d1f-a0e99c7dc40f,SRGI2013,0,Jl. Raya Muchtar No.22 Sawangan,Kota Depok,021 - 29669000,C
RUMAHSAKIT_PT_50K_2023_JAWABARAT.266,POINT (-6.588110986999936 106.79371240000006),1466,RS Ibu dan Anak Sawojajar,GI01050100,Swasta / Lainnya,528c628d-bc92-447d-8d1f-a0e99c7dc40f,SRGI2013,0,"Jl. Sawojajar No, 9 Bogor Tengah Kota Bogor",Kota Bogor,(0251) 832 4371,C
RUMAHSAKIT_PT_50K_2023_JAWABARAT.267,POINT (-6.427276801999938 106.82335190000003),1467,RS Umum Citra Medika Depok,GI01050100,Swasta / Lainnya,528c628d-bc92-447d-8d1f-a0e99c7dc40f,SRGI2013,0,"Jl. Raya Kalimulya No. 68, RT 6 RW 7, Kel. Kalimulya Kec. Cilodong",Kota Depok,021 - 29671000,C
RUMAHSAKIT_PT_50K_2023_JAWABARAT.268,POINT (-6.270758306999937 107.11470120000007),1468,RS Umum Bunda Mulia,GI01050100,Swasta / Lainnya,528c628d-bc92-447d-8d1f-a0e99c7dc40f,SRGI2013,0,"Jl. Imam Bonjol No. 80A Desa Sukadanau, Kecamatan Cikarang Barat, Kabupaten Bekasi",Bekasi,021-8900579/891,D
RUMAHSAKIT_PT_50K_2023_JAWABARAT.269,POINT (-6.363703507999958 107.53738850000008),1469,RS Umum Sentral Medika,GI01050100,Perusahaan,528c628d-bc92-447d-8d1f-a0e99c7dc40f,SRGI2013,0,Jl.Raya Cikalongsari No.42. Jatisari. Kab.Karawang,Karawang,(0264) 8375297,D
RUMAHSAKIT_PT_50K_2023_JAWABARAT.270,POINT (-6.437822729999937 107.05364500000007),1470,RS Umum Permata Jonggol,GI01050100,Perusahaan,528c628d-bc92-447d-8d1f-a0e99c7dc40f,SRGI2013,0,"Jl. Raya Cileungsi - Jonggol, Km. 1, Sukamanah - Jonggol",Bogor,021-89931222,C
RUMAHSAKIT_PT_50K_2023_JAWABARAT.271,POINT (-6.612857302999942 106.80789810000005),1471,RS Umum Vania,GI01050100,Perusahaan,528c628d-bc92-447d-8d1f-a0e99c7dc40f,SRGI2013,0,"JL. Siliwangi No. 11, Kel. Sukasari, Kec. Bogor Timur Kota Bogor",Kota Bogor,0251-8380601,C
RUMAHSAKIT_PT_50K_2023_JAWABARAT.272,POINT (-6.894052872999964 106.78525320000006),1472,RS Umum Kartika Cibadak,GI01050100,Swasta / Lainnya,528c628d-bc92-447d-8d1f-a0e99c7dc40f,SRGI2013,0,Jl. Siliwangi No.139,Sukabumi,(0266) 7160068,C
RUMAHSAKIT_PT_50K_2023_JAWABARAT.273,POINT (-6.173317790999931 107.17841680000004),1473,RS Umum Kasih Insani Sukatani,GI01050100,Perusahaan,528c628d-bc92-447d-8d1f-a0e99c7dc40f,SRGI2013,0,Jl. Raya Sukatani No. 9 Desa Karang Sentosa Kec. Karang Bahagia,Bekasi,021-89161340,D
RUMAHSAKIT_PT_50K_2023_JAWABARAT.274,POINT (-6.569211755999959 106.73827420000003),1474,RS Umum Karya Bhakti Pratiwi,GI01050100,Swasta / Lainnya,528c628d-bc92-447d-8d1f-a0e99c7dc40f,SRGI2013,0,Jl. Raya Dramaga KM. 7 Bogor,Bogor,0251-8626868,C
RUMAHSAKIT_PT_50K_2023_JAWABARAT.275,POINT (-6.575718850999976 106.80799170000006),1475,RS Umum Mulia Pajajaran,GI01050100,Perusahaan,528c628d-bc92-447d-8d1f-a0e99c7dc40f,SRGI2013,0,"Jl. Raya Pajajaran No. 98, Bantarjati - Bogor Utara, Kota Bogor",Kota Bogor,0251 - 837 9898,C
RUMAHSAKIT_PT_50K_2023_JAWABARAT.276,POINT (-6.552495489999956 106.77544300000005),1476,RS Ibu dan Anak Bunda Suryatni,GI01050100,Swasta / Lainnya,528c628d-bc92-447d-8d1f-a0e99c7dc40f,SRGI2013,0,"Jl. KH. Sholeh Iskandar No,21 Tanah Sareal Kota Bogor",Kota Bogor,0251-7543892,C
RUMAHSAKIT_PT_50K_2023_JAWABARAT.277,POINT (-7.218078774999981 107.92137420000006),1477,RS Umum Nurhayati Garut,GI01050100,Organisasi Sosial,528c628d-bc92-447d-8d1f-a0e99c7dc40f,SRGI2013,0,Jl. Jendral Sudirman No. 6,Garut,(0262) 238966,D
RUMAHSAKIT_PT_50K_2023_JAWABARAT.278,POINT (-6.2775233479999315 106.96081000000004),1478,RS Dokter Adam Talib Cikunir,GI01050100,Swasta / Lainnya,528c628d-bc92-447d-8d1f-a0e99c7dc40f,SRGI2013,0,Jl. Cikunir Raya Gang Hj. Napiah No.8 - Jakamulya Kota bekasi,Kota Bekasi,(021) 82437323,C
RUMAHSAKIT_PT_50K_2023_JAWABARAT.279,POINT (-6.943473248999965 107.64983450000005),1479,RS Edelweiss,GI01050100,Perusahaan,528c628d-bc92-447d-8d1f-a0e99c7dc40f,SRGI2013,0,Jl. Soekarno Hatta No. 550 Kel. Sekejati Kec. Buahbatu,Kota Bandung,,C
RUMAHSAKIT_PT_50K_2023_JAWABARAT.280,POINT (-6.955955049999943 107.66229550000008),1480,RS Ibu dan Anak Harapan Bunda Bandung,GI01050100,Swasta / Lainnya,528c628d-bc92-447d-8d1f-a0e99c7dc40f,SRGI2013,0,"Jl. Pluto Raya Blok C Margahayu Raya, Buah Batu, Kota Bandung",Kota Bandung,022-7506490,C
RUMAHSAKIT_PT_50K_2023_JAWABARAT.281,POINT (-6.952900156999931 107.58667300000008),1481,RS Umum Santosa Hospital Bandung Kopo,GI01050100,Swasta / Lainnya,528c628d-bc92-447d-8d1f-a0e99c7dc40f,SRGI2013,0,Jl. K.H. Wahid Hasyim (Kopo) No. 461-463 Bandung,Kota Bandung,022-54280333,A
RUMAHSAKIT_PT_50K_2023_JAWABARAT.282,POINT (-6.970139766999978 107.54901490000009),1482,RS Unggul Karsa Medika,GI01050100,Perusahaan,528c628d-bc92-447d-8d1f-a0e99c7dc40f,SRGI2013,0,"Jl. Taman Kopo Indah III Blok H No. 1, Desa MekarRahayu, Kecamatan MargaAsih, Kabupaten Bandung",Bandung,2286011220,C
RUMAHSAKIT_PT_50K_2023_JAWABARAT.283,POINT (-6.733609499999943 108.53919070000006),1483,RS Ibu dan Anak Cahaya Bunda,GI01050100,Swasta / Lainnya,528c628d-bc92-447d-8d1f-a0e99c7dc40f,SRGI2013,0,Jl. Raya Perjuangan No. 8 Cirebon,Kota Cirebon,0231-8333377/88,C
RUMAHSAKIT_PT_50K_2023_JAWABARAT.285,POINT (-7.213224924999963 107.92007000000007),1485,RS Umum Annisa Queen,GI01050100,Perusahaan,528c628d-bc92-447d-8d1f-a0e99c7dc40f,SRGI2013,0,Jln. Jenderal Sudirman No 208 Desa Suci Kaler Kecamatan Karangpawitan Kab. Garut,Garut,2624892700,D
RUMAHSAKIT_PT_50K_2023_JAWABARAT.286,POINT (-6.8864704099999585 107.58105250000006),1486,RS Gigi dan Mulut Maranatha,GI01050100,Swasta / Lainnya,528c628d-bc92-447d-8d1f-a0e99c7dc40f,SRGI2013,0,"Jl. Prof. drg. Suria Sumantri, MPH. No.65 Bandung",Kota Bandung,022 2005934 / 3,B
RUMAHSAKIT_PT_50K_2023_JAWABARAT.287,POINT (-6.344067002999964 108.32362420000004),1487,RS Umum MM Indramayu,GI01050100,Perusahaan,528c628d-bc92-447d-8d1f-a0e99c7dc40f,SRGI2013,0,Jl. Let.Jend Soeprapto No. 292 Indramayu,Indramayu,6234277632,D
RUMAHSAKIT_PT_50K_2023_JAWABARAT.288,POINT (-6.868043485999976 107.54458110000007),1488,RS Gigi dan Mulut Pendidikan Unjani,GI01050100,Swasta / Lainnya,528c628d-bc92-447d-8d1f-a0e99c7dc40f,SRGI2013,0,Jl. Encep Kartawiria Kel. Citeureup Kec. Cimahi Utara,Kota Cimahi,(022) 86001401,B
RUMAHSAKIT_PT_50K_2023_JAWABARAT.289,POINT (-6.797519179999938 107.17567420000006),1489,RS Umum Dr. Hafiz,GI01050100,Perorangan,528c628d-bc92-447d-8d1f-a0e99c7dc40f,SRGI2013,0,Jln. Pramuka No. 15 RT 003 RW 002 Desa Sukamulya Kecamtan Karangtengah Kabupaten Cianjur,Cianjur,(0263) 2910000,C
RUMAHSAKIT_PT_50K_2023_JAWABARAT.290,POINT (-6.319205144999955 106.98556580000007),1490,RS Umum Karya Medika Bantar Gebang,GI01050100,Perusahaan,528c628d-bc92-447d-8d1f-a0e99c7dc40f,SRGI2013,0,"Jl. Raya Narogong km. 11 Pangkalan 1A, Bantar Gebang Bekasi",Kota Bekasi,021-8254629-30,C
RUMAHSAKIT_PT_50K_2023_JAWABARAT.291,POINT (-6.837998724999977 107.59821870000007),1491,RS Umum Daerah Lembang,GI01050100,Pemerintah Kabupaten,528c628d-bc92-447d-8d1f-a0e99c7dc40f,SRGI2013,0,"Jl. Raya Lembang KM.11,4 No.11 Desa Gudang Kahuripan Kec. Lembang",Bandung Barat,(022) 2786879,C
RUMAHSAKIT_PT_50K_2023_JAWABARAT.292,POINT (-7.013428986999941 108.62247390000005),1492,RS Umum KMC Luragung,GI01050100,Perusahaan,528c628d-bc92-447d-8d1f-a0e99c7dc40f,SRGI2013,0,Dusun Rahayu RT.002/001 Desa Cirahayu Kec. Luragung Kab. Kuningan,Kuningan,2328900112,C
RUMAHSAKIT_PT_50K_2023_JAWABARAT.293,POINT (-6.70819359099994 108.53381960000007),1493,RS Umum Permata Cirebon,GI01050100,Swasta / Lainnya,528c628d-bc92-447d-8d1f-a0e99c7dc40f,SRGI2013,0,Jl. Tuparev No.117 Cirebon,Cirebon,0231-8338877,B
RUMAHSAKIT_PT_50K_2023_JAWABARAT.294,POINT (-6.863039514999969 107.50298510000005),1494,RS Karisma Cimareme,GI01050100,Perusahaan,528c628d-bc92-447d-8d1f-a0e99c7dc40f,SRGI2013,0,Jl. Raya Cimareme No. 235 RT. 03 RW. 01 Kec.Ngamprah,Bandung Barat,022-6866221,C
RUMAHSAKIT_PT_50K_2023_JAWABARAT.295,POINT (-7.190764034999972 107.89671510000005),1495,RS Umum Intan Husada,GI01050100,Swasta / Lainnya,528c628d-bc92-447d-8d1f-a0e99c7dc40f,SRGI2013,0,Jl. Suherman Nomor 72 Desa Tarogong Kec. Tarogong Kidul Kabupaten Garut 44151 Provinsi Jawa Barat,Garut,0262 2247769,C
