FID,geom,OBJECTID,NAMOBJ,FCODE,REMARK,METADATA,SRS_ID,JPLYRS,RSALAMAT,WADMKK,TELEPON,TIPRST
RUMAHSAKIT_PT_50K_2023_JAWABARAT.1,POINT (-6.375642108999955 106.91837670000007),1201,RS Umum Mitra Keluarga Cibubur,GI01050100,Perusahaan,528c628d-bc92-447d-8d1f-a0e99c7dc40f,SRGI2013,0,"Jl. Alternatif Transyogi, Cibubur",Kota Bekasi,021-84311777,C
RUMAHSAKIT_PT_50K_2023_JAWABARAT.2,POINT (-6.688008585999967 106.93955270000004),1202,RS Paru Dr. M. Goenawan Partowidigdo,GI01050100,Kementerian Kesehatan,528c628d-bc92-447d-8d1f-a0e99c7dc40f,SRGI2013,0,"Jl. Raya Puncak KM.83, Po Box 28 Cisarua Bogor 16750",Bogor,0251-8253630,A
RUMAHSAKIT_PT_50K_2023_JAWABARAT.3,POINT (-6.396423931999948 106.80621100000008),1203,RS Umum Bhakti Yudha,GI01050100,Organisasi Sosial,528c628d-bc92-447d-8d1f-a0e99c7dc40f,SRGI2013,0,Jl. Raya Sawangan No. 2A Depok,Kota Depok,021-7520082,C
RUMAHSAKIT_PT_50K_2023_JAWABARAT.4,POINT (-6.472932406999973 106.83055660000008),1204,RS Umum Daerah Cibinong,GI01050100,Pemerintah Kabupaten,528c628d-bc92-447d-8d1f-a0e99c7dc40f,SRGI2013,0,JL. KSR Dadi Kusmayadi No. 27 Cibinong Bogor,Bogor,021-8753487,B
RUMAHSAKIT_PT_50K_2023_JAWABARAT.5,POINT (-6.659874570999932 106.85307460000007),1205,RS Umum Daerah Ciawi,GI01050100,Pemerintah Kabupaten,528c628d-bc92-447d-8d1f-a0e99c7dc40f,SRGI2013,0,Jl. Raya Puncak 479 Ciawi Bogor,Bogor,0251-8240797,B
RUMAHSAKIT_PT_50K_2023_JAWABARAT.6,POINT (-6.355746174999979 106.86033500000008),1206,RS Umum Tugu Ibu,GI01050100,Organisasi Sosial,528c628d-bc92-447d-8d1f-a0e99c7dc40f,SRGI2013,0,Jl. Raya Bogor Km 29 Cimanggis - Depok,Kota Depok,021 8710870,C
RUMAHSAKIT_PT_50K_2023_JAWABARAT.7,POINT (-6.321095629999945 106.78268400000007),1207,RS Umum Puri Cinere,GI01050100,Swasta / Lainnya,528c628d-bc92-447d-8d1f-a0e99c7dc40f,SRGI2013,0,"Jl. Maribaya No.1 Puri Cinere,Depok",Kota Depok,021-7545488,B
RUMAHSAKIT_PT_50K_2023_JAWABARAT.8,POINT (-6.472423136999964 106.86363600000004),1208,RS Umum Bina Husada,GI01050100,Swasta / Lainnya,528c628d-bc92-447d-8d1f-a0e99c7dc40f,SRGI2013,0,Jl. Mayor Oking Jaya Atmaja KM1 No.101 Cibinong - Bogor,Bogor,021-87911000,C
RUMAHSAKIT_PT_50K_2023_JAWABARAT.9,POINT (-6.398677138999972 106.82526770000004),1209,RS Umum Hermina Depok,GI01050100,Organisasi Sosial,528c628d-bc92-447d-8d1f-a0e99c7dc40f,SRGI2013,0,Jl. Raya Siliwangi No. 50 Pancoran Mas Depok,Kota Depok,021-77202525,B
RUMAHSAKIT_PT_50K_2023_JAWABARAT.10,POINT (-6.44340929599997 106.73300420000004),1210,RS Ibu dan Anak Citra Insani,GI01050100,Swasta / Lainnya,528c628d-bc92-447d-8d1f-a0e99c7dc40f,SRGI2013,0,"Jl. Raya Parung No.242 Lebakwangi, Pemagarsari - Bogor",Bogor,0251-8611507,C
RUMAHSAKIT_PT_50K_2023_JAWABARAT.11,POINT (-6.374121298999967 106.86321040000007),1211,RS Ibu dan Anak Tumbuh Kembang,GI01050100,Organisasi Sosial,528c628d-bc92-447d-8d1f-a0e99c7dc40f,SRGI2013,0,Jl. Raya Bogor Km.31 No.23 Cimanggis Kota Depok,Kota Depok,(021)8701873/74,C
RUMAHSAKIT_PT_50K_2023_JAWABARAT.12,POINT (-6.398834032999957 106.96941360000005),1212,RS Umum Mary Cileungsi Hijau,GI01050100,Swasta / Lainnya,528c628d-bc92-447d-8d1f-a0e99c7dc40f,SRGI2013,0,Jl. Raya Narogong Km 21 Cileungsi Bogor,Bogor,021 - 8249 2222,C
RUMAHSAKIT_PT_50K_2023_JAWABARAT.13,POINT (-6.376022807999959 106.90188990000007),1213,RS Umum Meilia,GI01050100,Swasta / Lainnya,528c628d-bc92-447d-8d1f-a0e99c7dc40f,SRGI2013,0,"Jl. Alternatif Cibubur KM. 1, Kel. Harjamukti, Cimanggis, Kota Depok",Kota Depok,021 - 8444444,B
RUMAHSAKIT_PT_50K_2023_JAWABARAT.14,POINT (-6.364548587999934 106.83456910000007),1214,RS Umum Bunda Margonda,GI01050100,Swasta / Lainnya,528c628d-bc92-447d-8d1f-a0e99c7dc40f,SRGI2013,0,"Jl. Margonda Raya No.28 RT002 RW003 Kelurahan Pondok Cina Kecamatan Beji , Depok - Jawa Barat",Kota Depok,2178890551,C
RUMAHSAKIT_PT_50K_2023_JAWABARAT.15,POINT (-6.374916394999957 106.97090120000007),1215,RS Umum MH. Thamrin,GI01050100,Swasta / Lainnya,528c628d-bc92-447d-8d1f-a0e99c7dc40f,SRGI2013,0,"Jl. Raya Narogong Km.16, Limus Nunggal Cileungsi, Bogor",Bogor,021-8235052,C
RUMAHSAKIT_PT_50K_2023_JAWABARAT.16,POINT (-6.558204830999955 106.79195120000009),1216,RS Umum Islam Bogor,GI01050100,Organisasi Sosial,528c628d-bc92-447d-8d1f-a0e99c7dc40f,SRGI2013,0,"Jl. Perdana Raya No.22, Tanah Sareal, Bogor Utara Kota Bogor",Kota Bogor,0251-8316822,C
RUMAHSAKIT_PT_50K_2023_JAWABARAT.17,POINT (-6.894407040999965 106.79316950000003),1217,RS Umum Daerah Sekarwangi,GI01050100,Pemerintah Kabupaten,528c628d-bc92-447d-8d1f-a0e99c7dc40f,SRGI2013,0,Jl. Siliwangi No. 49 Cibadak Sukabumi,Sukabumi,0266-531261,B
RUMAHSAKIT_PT_50K_2023_JAWABARAT.18,POINT (-6.988039158999925 106.55752840000008),1218,RS Umum Daerah Palabuhanratu,GI01050100,Pemerintah Kabupaten,528c628d-bc92-447d-8d1f-a0e99c7dc40f,SRGI2013,0,Jl. Ahmad Yani No.2 Palabuhanratu,Sukabumi,0266-432081,C
RUMAHSAKIT_PT_50K_2023_JAWABARAT.19,POINT (-7.252591849999931 106.62518140000009),1219,RS Umum Daerah Jampang Kulon,GI01050100,Pemerintah Provinsi,528c628d-bc92-447d-8d1f-a0e99c7dc40f,SRGI2013,0,"Jl. Cibarusah No.1 Jampang Kulon, Kab.Sukabumi",Sukabumi,0266-490009,C
RUMAHSAKIT_PT_50K_2023_JAWABARAT.20,POINT (-6.917385635999949 106.96149670000005),1220,RS Umum Hermina Sukabumi,GI01050100,Swasta / Lainnya,528c628d-bc92-447d-8d1f-a0e99c7dc40f,SRGI2013,0,"Jl. Raya Sukaraja, Kabupaten Sukabumi",Sukabumi,-6246259,C
RUMAHSAKIT_PT_50K_2023_JAWABARAT.21,POINT (-6.809755313999972 107.14134190000004),1221,RS Umum Daerah Sayang,GI01050100,Pemerintah Kabupaten,528c628d-bc92-447d-8d1f-a0e99c7dc40f,SRGI2013,0,Jl. Rumah Sakit No.1 Cianjur,Cianjur,0263-261026,B
RUMAHSAKIT_PT_50K_2023_JAWABARAT.22,POINT (-6.720057468999926 107.03238430000005),1222,RS Umum Daerah Cimacan,GI01050100,Pemerintah Kabupaten,528c628d-bc92-447d-8d1f-a0e99c7dc40f,SRGI2013,0,"Jl. Raya Cimacan No.17, Cianjur",Cianjur,0263-512465,C
RUMAHSAKIT_PT_50K_2023_JAWABARAT.23,POINT (-7.048487712999929 107.77219760000008),1223,RS Umum Daerah Majalaya,GI01050100,Pemerintah Kabupaten,528c628d-bc92-447d-8d1f-a0e99c7dc40f,SRGI2013,0,Jl. Raya Cipaku No.87 Majalaya Kabupaten Bandung,Bandung,022-5950035,B
RUMAHSAKIT_PT_50K_2023_JAWABARAT.24,POINT (-6.878671532999931 107.55113670000009),1224,RS Umum Daerah Cibabat,GI01050100,Pemerintah Kota,528c628d-bc92-447d-8d1f-a0e99c7dc40f,SRGI2013,0,Jl. Jend. H. Amir Machmud No. 140 Kel. Cibabat Kec. Cimahi Utara,Kota Cimahi,(022) 6652025,B
RUMAHSAKIT_PT_50K_2023_JAWABARAT.25,POINT (-6.88566515399998 107.53483250000005),1225,RS Umum Tk. II Dustira,GI01050100,TNI AD,528c628d-bc92-447d-8d1f-a0e99c7dc40f,SRGI2013,0,Jl. dr. Dustira No.1 Kel. Baros Kec. Cimahi Tengah,Kota Cimahi,022-6652207,B
RUMAHSAKIT_PT_50K_2023_JAWABARAT.26,POINT (-6.809301064999943 107.56415880000009),1226,RS Jiwa Provinsi Jawa Barat,GI01050100,Pemerintah Provinsi,528c628d-bc92-447d-8d1f-a0e99c7dc40f,SRGI2013,0,Jl. Kolonel Masturi KM 7 Cisarua - Bandung Barat,Bandung Barat,022-2700260,A
RUMAHSAKIT_PT_50K_2023_JAWABARAT.27,POINT (-6.884015121999937 107.55281890000003),1227,RS Umum Mitra Kasih,GI01050100,Organisasi Sosial,528c628d-bc92-447d-8d1f-a0e99c7dc40f,SRGI2013,0,Jl. Jend.Amir Machmud No.341 Kel. Cigugur Tengah Kec. Cimahi Tengah Kota Cimahi,Kota Cimahi,022-6654852,C
RUMAHSAKIT_PT_50K_2023_JAWABARAT.28,POINT (-7.007995948999962 107.62298270000008),1228,RS Umum Daerah Al Ihsan Provinsi Jawa Barat,GI01050100,Pemerintah Provinsi,528c628d-bc92-447d-8d1f-a0e99c7dc40f,SRGI2013,0,Jl. Ki Astramanggala Bale Endah Kab. Bandung,Bandung,022-5940872,B
RUMAHSAKIT_PT_50K_2023_JAWABARAT.29,POINT (-7.027555129999939 107.54350170000004),1229,RS Umum Daerah Oto Iskandar Di Nata,GI01050100,Pemerintah Kabupaten,528c628d-bc92-447d-8d1f-a0e99c7dc40f,SRGI2013,0,"Jl. Raya Gading Tutuka, Kp. Cingcin Kolot, RT 01 RW 17, Desa Cingcin, Kec. Soreang, Kab. Bandung, Provinsi Jawa Barat",Bandung,022-5891355,C
RUMAHSAKIT_PT_50K_2023_JAWABARAT.30,POINT (-6.981693894999978 107.84248220000006),1230,RS Umum Daerah Cicalengka,GI01050100,Pemerintah Kabupaten,528c628d-bc92-447d-8d1f-a0e99c7dc40f,SRGI2013,0,"Jl. H. Darham No.35 - Cikopo, Cicalengka Kab. Bandung",Bandung,227952203,C
RUMAHSAKIT_PT_50K_2023_JAWABARAT.31,POINT (-7.21939217399995 107.89712240000006),1231,RS Umum Daerah dr. Slamet Garut,GI01050100,Pemerintah Kabupaten,528c628d-bc92-447d-8d1f-a0e99c7dc40f,SRGI2013,0,Jl. Rumah Sakit No.12 Garut,Garut,0262-232720,B
RUMAHSAKIT_PT_50K_2023_JAWABARAT.32,POINT (-7.224512334999929 107.91095790000008),1232,RS Umum Tk. IV Guntur,GI01050100,TNI AD,528c628d-bc92-447d-8d1f-a0e99c7dc40f,SRGI2013,0,Jl. Bratayuda 101 Garut,Garut,(0262)232325,C
RUMAHSAKIT_PT_50K_2023_JAWABARAT.33,POINT (-7.3318128769999475 108.22504090000007),1233,RS Umum Daerah dr. Soekardjo,GI01050100,Pemerintah Kota,528c628d-bc92-447d-8d1f-a0e99c7dc40f,SRGI2013,0,Jl. Rumah Sakit 33 Tasikmalaya,Kota Tasikmalaya,(0265) 331683,B
RUMAHSAKIT_PT_50K_2023_JAWABARAT.34,POINT (-7.378759293999963 108.23277060000004),1234,RS Umum Islam Hj. Siti Muniroh,GI01050100,Organisasi Islam,528c628d-bc92-447d-8d1f-a0e99c7dc40f,SRGI2013,0,Jl. Tamansari Gobras No.228 Kota Tasikmalaya,Kota Tasikmalaya,0265-323868,D
RUMAHSAKIT_PT_50K_2023_JAWABARAT.35,POINT (-7.326018909999959 108.22276660000006),1235,RS Umum Jasa Kartini,GI01050100,Perusahaan,528c628d-bc92-447d-8d1f-a0e99c7dc40f,SRGI2013,0,Jl. Otto Iskandar Dinata No 15,Kota Tasikmalaya,0265 331808,C
RUMAHSAKIT_PT_50K_2023_JAWABARAT.36,POINT (-7.305116816999941 108.20513120000004),1236,RS Umum Prasetya Bunda,GI01050100,Swasta / Lainnya,528c628d-bc92-447d-8d1f-a0e99c7dc40f,SRGI2013,0,"Jl. Ir. H. Juanda No.1 RT03/RW03, Kelurahan Panyingkiran, Kecamatan Indihiang, Kota Tasikmalaya, Provinsi Jawa Barat, 46411",Kota Tasikmalaya,265344477,C
RUMAHSAKIT_PT_50K_2023_JAWABARAT.37,POINT (-7.334343171999933 108.35938990000005),1237,RS Umum Daerah Kab. Ciamis,GI01050100,Pemerintah Kabupaten,528c628d-bc92-447d-8d1f-a0e99c7dc40f,SRGI2013,0,Jl. Rumah Sakit No.76 Ciamis,Ciamis,0265-772118,C
RUMAHSAKIT_PT_50K_2023_JAWABARAT.38,POINT (-7.369431550999934 108.54374690000009),1238,RS Umum Daerah Banjar,GI01050100,Pemerintah Kota,528c628d-bc92-447d-8d1f-a0e99c7dc40f,SRGI2013,0,Jl. Rumah Sakit No. 5 Kota Banjar,Kota Banjar,0265-741032,B
RUMAHSAKIT_PT_50K_2023_JAWABARAT.39,POINT (-7.330798379999976 108.36298540000007),1239,RS Umum Permata Bunda,GI01050100,Organisasi Sosial,528c628d-bc92-447d-8d1f-a0e99c7dc40f,SRGI2013,0,Jl. Mr. Iwa Kusumasomantri No.1 Ciamis,Kota Tasikmalaya,265345650,C
RUMAHSAKIT_PT_50K_2023_JAWABARAT.40,POINT (-6.984270755999944 108.48146310000004),1240,RS Umum Daerah 45 Kuningan,GI01050100,Pemerintah Kabupaten,528c628d-bc92-447d-8d1f-a0e99c7dc40f,SRGI2013,0,Jl. Jendral Sudirman No. 68 Kuningan,Kuningan,0232-871885,B
RUMAHSAKIT_PT_50K_2023_JAWABARAT.41,POINT (-6.970543951999957 108.50597960000005),1241,RS Umum Wijaya Kusumah,GI01050100,Organisasi Sosial,528c628d-bc92-447d-8d1f-a0e99c7dc40f,SRGI2013,0,Jl. RE Martadinata No. 172 Kab. Kuningan,Kuningan,0232-871565,C
RUMAHSAKIT_PT_50K_2023_JAWABARAT.42,POINT (-6.968094366999935 108.45531770000008),1242,RS Umum Sekar Kamulyan,GI01050100,Organisasi Sosial,528c628d-bc92-447d-8d1f-a0e99c7dc40f,SRGI2013,0,Jl. Rumah Sakit No. 28 Kec. Cigugur Kab. Kuningan,Kuningan,873206,C
RUMAHSAKIT_PT_50K_2023_JAWABARAT.43,POINT (-6.912748940999961 108.71848330000006),1243,RS Umum Daerah Waled,GI01050100,Pemerintah Kabupaten,528c628d-bc92-447d-8d1f-a0e99c7dc40f,SRGI2013,0,"Jl. Prabu Kiansantang No. 4 Waled, Cirebon",Cirebon,0231-661126,B
RUMAHSAKIT_PT_50K_2023_JAWABARAT.44,POINT (-6.684000429999969 108.55215180000005),1244,RS Pertamina Cirebon,GI01050100,Swasta / Lainnya,528c628d-bc92-447d-8d1f-a0e99c7dc40f,SRGI2013,0,Jl. Patra Raya Klayan No 1 Cirebon,Cirebon,0231-224646,C
RUMAHSAKIT_PT_50K_2023_JAWABARAT.45,POINT (-6.797074688999942 108.47530590000008),1245,RS Paru Provinsi Jawa Barat,GI01050100,Pemerintah Provinsi,528c628d-bc92-447d-8d1f-a0e99c7dc40f,SRGI2013,0,"Jl. Pangeran Kejaksan PO.BOX 4 Desa Sidawangi, Kecamatan Sumber Kab. Cirebon",Cirebon,0231-8330707,B
RUMAHSAKIT_PT_50K_2023_JAWABARAT.46,POINT (-6.656397677999962 108.41269600000004),1246,RS Umum Daerah Arjawinangun,GI01050100,Pemerintah Kabupaten,528c628d-bc92-447d-8d1f-a0e99c7dc40f,SRGI2013,0,Jl. By Pass Palimanan - Jakarta KM. 2 No. 1 Arjawinangun,Cirebon,0231-358335,B
RUMAHSAKIT_PT_50K_2023_JAWABARAT.47,POINT (-6.701637976999962 108.48164150000008),1247,RS Umum Mitra Plumbon,GI01050100,Swasta / Lainnya,528c628d-bc92-447d-8d1f-a0e99c7dc40f,SRGI2013,0,Jl. Raya Plumbon Km.11 Cirebon,Cirebon,323100,B
RUMAHSAKIT_PT_50K_2023_JAWABARAT.48,POINT (-6.833545507999929 108.23335110000005),1248,RS Umum Daerah Majalengka,GI01050100,Pemerintah Kabupaten,528c628d-bc92-447d-8d1f-a0e99c7dc40f,SRGI2013,0,Jl. Kesehatan No.77 Majalengka,Majalengka,0233-281043,C
RUMAHSAKIT_PT_50K_2023_JAWABARAT.49,POINT (-6.7601911719999634 108.19481490000004),1249,RS Umum Daerah Cideres,GI01050100,Pemerintah Kabupaten,528c628d-bc92-447d-8d1f-a0e99c7dc40f,SRGI2013,0,Jl. Raya Cideres - Kadipaten No. 180 Desa Bojong Cideres Kecamatan Dawuan Kabupaten Majalengka 45453,Majalengka,"(0233)-662082,",B
RUMAHSAKIT_PT_50K_2023_JAWABARAT.50,POINT (-6.799708555999928 108.18311340000008),1250,RS Bedah Budi Kasih,GI01050100,Organisasi Sosial,528c628d-bc92-447d-8d1f-a0e99c7dc40f,SRGI2013,0,Jl. Raya Majalengka - Kadipaten Km.7 no 84,Majalengka,0233-8665508 -,C
RUMAHSAKIT_PT_50K_2023_JAWABARAT.51,POINT (-6.85686310899996 107.92140280000007),1251,RS Umum Daerah Sumedang,GI01050100,Pemerintah Kabupaten,528c628d-bc92-447d-8d1f-a0e99c7dc40f,SRGI2013,0,Jl. Prabu Geusan Ulun No 41 Jl. Palasari No. 80 Kabupaten Sumedang,Sumedang,0261-201021,B
RUMAHSAKIT_PT_50K_2023_JAWABARAT.52,POINT (-6.856970708999938 107.92378240000005),1252,RS Umum Pakuwon,GI01050100,Swasta / Lainnya,528c628d-bc92-447d-8d1f-a0e99c7dc40f,SRGI2013,0,Jl. Raden Dewi Sartika No. 17 Kel. Regol Wetan Kec. Sumedang Selatan Kab. Sumedang Prov. Jabar,Sumedang,0261 210834,C
RUMAHSAKIT_PT_50K_2023_JAWABARAT.53,POINT (-6.329619510999976 108.32196350000004),1253,RS Umum Daerah Kab. Indramayu,GI01050100,Pemerintah Kabupaten,528c628d-bc92-447d-8d1f-a0e99c7dc40f,SRGI2013,0,Jl. Murah Nara No. 7 Sindang Indramayu,Indramayu,0234-272655,B
RUMAHSAKIT_PT_50K_2023_JAWABARAT.54,POINT (-6.313827351999976 107.99860610000007),1254,RS Umum Daerah M. A. Sentot Patrol,GI01050100,Pemerintah Kabupaten,528c628d-bc92-447d-8d1f-a0e99c7dc40f,SRGI2013,0,Jl. Raya Patrol Km. 46 Patrol Kab. Indramayu,Indramayu,234612715,C
RUMAHSAKIT_PT_50K_2023_JAWABARAT.55,POINT (-6.557484109999962 107.74708250000003),1255,RS Umum Daerah Subang,GI01050100,Pemerintah Kabupaten,528c628d-bc92-447d-8d1f-a0e99c7dc40f,SRGI2013,0,Jl. Brigjen Katamso No. 37 Ciereng,Subang,(0260)411421,B
RUMAHSAKIT_PT_50K_2023_JAWABARAT.56,POINT (-6.568158288999939 107.76278430000008),1256,RS Umum PTPN VIII,GI01050100,BUMN,528c628d-bc92-447d-8d1f-a0e99c7dc40f,SRGI2013,0,Jl. Otto Iskandardinata No.1 Kab. Subang,Subang,0260-420406,D
RUMAHSAKIT_PT_50K_2023_JAWABARAT.57,POINT (-6.51626917699997 107.66311180000008),1257,RSAU dr. Hoediyono Lanud Suryadarma,GI01050100,TNI AU,528c628d-bc92-447d-8d1f-a0e99c7dc40f,SRGI2013,0,Komplek TNI AU Lanud Suryadarma Kec. Kalijati Kab. Subang,Subang,260462225,D
RUMAHSAKIT_PT_50K_2023_JAWABARAT.58,POINT (-6.539152077999972 107.44357280000008),1258,RS Umum Daerah Bayu Asih,GI01050100,Pemerintah Kabupaten,528c628d-bc92-447d-8d1f-a0e99c7dc40f,SRGI2013,0,Jl. Veteran No. 39 Purwakarta,Purwakarta,0264-200100,B
RUMAHSAKIT_PT_50K_2023_JAWABARAT.59,POINT (-6.320663391999972 107.29250750000006),1259,RS Umum Daerah Karawang,GI01050100,Pemerintah Kabupaten,528c628d-bc92-447d-8d1f-a0e99c7dc40f,SRGI2013,0,"Jl. Galuh Mas Raya No.1, Sukaharja, Teluk Jambe, Karawang",Karawang,0267-640444,B
RUMAHSAKIT_PT_50K_2023_JAWABARAT.60,POINT (-6.303432395999948 107.29211170000008),1260,RS Umum Bayukarta,GI01050100,Organisasi Protestan,528c628d-bc92-447d-8d1f-a0e99c7dc40f,SRGI2013,0,Jl. Kertabumi No.44 Karawang,Karawang,0267 401818,C
RUMAHSAKIT_PT_50K_2023_JAWABARAT.61,POINT (-6.400815413999965 107.44371830000006),1261,RS Umum Karya Husada,GI01050100,Perusahaan,528c628d-bc92-447d-8d1f-a0e99c7dc40f,SRGI2013,0,Jl. Jend. A.Yani No.98 Cikampek Karawang,Karawang,0264-316188/89,C
RUMAHSAKIT_PT_50K_2023_JAWABARAT.62,POINT (-6.168709796999963 107.29725710000008),1262,RS Umum Proklamasi,GI01050100,Swasta / Lainnya,528c628d-bc92-447d-8d1f-a0e99c7dc40f,SRGI2013,0,"Jl. Raya Proklamasi KM. 2 Rengasdengklok, Karawang",Karawang,0267-482192,C
RUMAHSAKIT_PT_50K_2023_JAWABARAT.63,POINT (-6.281507765999947 107.28335580000004),1263,RS Umum Islam Karawang,GI01050100,Organisasi Sosial,528c628d-bc92-447d-8d1f-a0e99c7dc40f,SRGI2013,0,"Jl. Pangkal Perjuangan KM.2, Karawang",Karawang,(0267)414522,C
RUMAHSAKIT_PT_50K_2023_JAWABARAT.64,POINT (-6.404050095999935 107.45018940000006),1264,RS Umum Saraswati,GI01050100,Swasta / Lainnya,528c628d-bc92-447d-8d1f-a0e99c7dc40f,SRGI2013,0,"Jl. Jend. Ahmad Yani No.27, Cikampek, Kab. Karawang",Karawang,0264-316101,D
RUMAHSAKIT_PT_50K_2023_JAWABARAT.65,POINT (-6.315003011999977 107.31652980000007),1265,RS Umum Delima Asih Sisma Medika,GI01050100,Swasta / Lainnya,528c628d-bc92-447d-8d1f-a0e99c7dc40f,SRGI2013,0,"Jl. Wirasaba No.54, Johar - Karawang",Karawang,403073,D
RUMAHSAKIT_PT_50K_2023_JAWABARAT.66,POINT (-6.305009512999959 107.30214740000008),1266,RS Ibu dan Anak Dr. Djoko Pramono,GI01050100,Swasta / Lainnya,528c628d-bc92-447d-8d1f-a0e99c7dc40f,SRGI2013,0,"Jl. Panatayuda I No.35, Karawang",Karawang,0267 403009,C
RUMAHSAKIT_PT_50K_2023_JAWABARAT.67,POINT (-6.349814111999933 107.37761720000009),1267,RS Umum Citra Sari Husada,GI01050100,Swasta / Lainnya,528c628d-bc92-447d-8d1f-a0e99c7dc40f,SRGI2013,0,"Jl. Raya Kosambi -Telaga Sari Km.3 Klari, Karawang",Karawang,0267-437507,C
RUMAHSAKIT_PT_50K_2023_JAWABARAT.68,POINT (-6.3896525079999265 107.46663480000007),1268,RS Umum Izza,GI01050100,Swasta / Lainnya,528c628d-bc92-447d-8d1f-a0e99c7dc40f,SRGI2013,0,"Jl. Raya Ciselang Cikampek Utara, Kotabaru Kab.Karawang",Karawang,0264-8386830-29,C
RUMAHSAKIT_PT_50K_2023_JAWABARAT.69,POINT (-6.304883099999927 107.27795860000003),1269,RS Umum Mandaya,GI01050100,Swasta / Lainnya,528c628d-bc92-447d-8d1f-a0e99c7dc40f,SRGI2013,0,Jl. Arteri Tol Karawang Barat Teluk jambe Karawang,Karawang,0267-8643000,C
RUMAHSAKIT_PT_50K_2023_JAWABARAT.70,POINT (-6.242071452999937 107.00065780000006),1270,RS Umum Daerah dr. Chasbullah Abdulmadjid,GI01050100,Pemerintah Kota,528c628d-bc92-447d-8d1f-a0e99c7dc40f,SRGI2013,0,Jl. Pramuka No. 55 Bekasi,Kota Bekasi,021-8841005,B
RUMAHSAKIT_PT_50K_2023_JAWABARAT.71,POINT (-6.232929819999981 107.01088190000007),1271,RS Mekar Sari,GI01050100,Organisasi Sosial,528c628d-bc92-447d-8d1f-a0e99c7dc40f,SRGI2013,0,Jl. Mekar Sari No. 1 Bekasi,Kota Bekasi,"021-8813787, 02",C
RUMAHSAKIT_PT_50K_2023_JAWABARAT.72,POINT (-6.296349827999961 106.92112790000004),1272,RS Helsa,GI01050100,Swasta / Lainnya,528c628d-bc92-447d-8d1f-a0e99c7dc40f,SRGI2013,0,Jl. Raya Hankam No. 17 Pondok Melati Kota Bekasi,Kota Bekasi,8462565/64,C
RUMAHSAKIT_PT_50K_2023_JAWABARAT.73,POINT (-6.262659922999944 107.14025440000006),1273,RS Umum Bhakti Husada,GI01050100,Organisasi Sosial,528c628d-bc92-447d-8d1f-a0e99c7dc40f,SRGI2013,0,Jl. R. E. Martadinata (By Pass) Cikarang - Bekasi,Bekasi,021 890 0530-31,C
RUMAHSAKIT_PT_50K_2023_JAWABARAT.74,POINT (-6.201799536999943 106.98881490000008),1274,RS Seto Hasbadi,GI01050100,Organisasi Sosial,528c628d-bc92-447d-8d1f-a0e99c7dc40f,SRGI2013,0,Jl. Raya Seroja No. 19 Harapan Jaya Bekasi Utara,Kota Bekasi,021 -8866141/42,D
RUMAHSAKIT_PT_50K_2023_JAWABARAT.75,POINT (-6.240817898999978 106.99263450000007),1275,RS Umum Mitra Keluarga Bekasi,GI01050100,Swasta / Lainnya,528c628d-bc92-447d-8d1f-a0e99c7dc40f,SRGI2013,0,"Jl. Jend. Ahmad Yani - Kayuringin Jaya, Bekasi",Kota Bekasi,021-8853333,B
RUMAHSAKIT_PT_50K_2023_JAWABARAT.76,POINT (-6.266843741999935 107.12472230000009),1276,RS Umum Karya Medika,GI01050100,Organisasi Sosial,528c628d-bc92-447d-8d1f-a0e99c7dc40f,SRGI2013,0,Jl. Imam Bonjol No. 9B Kalijaya Cikarang Barat,Bekasi,0218900190/191,C
RUMAHSAKIT_PT_50K_2023_JAWABARAT.77,POINT (-6.241658418999975 106.99485900000008),1277,RS Umum Hermina Bekasi,GI01050100,Swasta / Lainnya,528c628d-bc92-447d-8d1f-a0e99c7dc40f,SRGI2013,0,Jl. Kemakmuran No.39 Margajaya Bekasi,Kota Bekasi,021-8842121,B
RUMAHSAKIT_PT_50K_2023_JAWABARAT.78,POINT (-6.272999170999981 107.17426520000004),1278,RS Umum Annisa,GI01050100,Swasta / Lainnya,528c628d-bc92-447d-8d1f-a0e99c7dc40f,SRGI2013,0,Jl. Cikarang Baru No.31 Cikarang Utara Bekasi,Bogor,021-8756780,C
RUMAHSAKIT_PT_50K_2023_JAWABARAT.79,POINT (-6.248026617999926 107.00179140000006),1279,RS Umum Bhakti Kartini,GI01050100,Organisasi Sosial,528c628d-bc92-447d-8d1f-a0e99c7dc40f,SRGI2013,0,Jl. R.A. Kartini No. 11 Bekasi,Kota Bekasi,8801954,C
RUMAHSAKIT_PT_50K_2023_JAWABARAT.80,POINT (-6.331114388999936 107.13513410000007),1280,Siloam Hospitals Lippo Cikarang,GI01050100,Swasta / Lainnya,528c628d-bc92-447d-8d1f-a0e99c7dc40f,SRGI2013,0,Jl. MH Thamrin Kav.105 Bekasi,Bekasi,021-296 36 900,B
RUMAHSAKIT_PT_50K_2023_JAWABARAT.81,POINT (-6.278813987999968 107.15157410000006),1281,RS Umum Sentra Medika,GI01050100,Organisasi Sosial,528c628d-bc92-447d-8d1f-a0e99c7dc40f,SRGI2013,0,Jl. Raya Industri Pasirgombong Cikarang,Kota Depok,8743790,B
RUMAHSAKIT_PT_50K_2023_JAWABARAT.82,POINT (-6.280394601999944 106.99881220000009),1282,RS Umum Rawa Lumbu,GI01050100,Organisasi Sosial,528c628d-bc92-447d-8d1f-a0e99c7dc40f,SRGI2013,0,Jl. Dasa Darma 20-23 Bekasi,Kota Bekasi,218242251,C
RUMAHSAKIT_PT_50K_2023_JAWABARAT.83,POINT (-6.330742913999927 107.13058040000004),1283,RS Umum Hosana Medica,GI01050100,Swasta / Lainnya,528c628d-bc92-447d-8d1f-a0e99c7dc40f,SRGI2013,0,"Jl. BIIE Utama no. 1, Lippo Cikarang",Bekasi,021-8972472,C
RUMAHSAKIT_PT_50K_2023_JAWABARAT.84,POINT (-6.246855720999974 107.01081200000004),1284,RS Umum Bella,GI01050100,Swasta / Lainnya,528c628d-bc92-447d-8d1f-a0e99c7dc40f,SRGI2013,0,"Jl. Ir. H .Juanda No. 141, Bekasi",Kota Bekasi,021-8801778,C
RUMAHSAKIT_PT_50K_2023_JAWABARAT.85,POINT (-6.252029038999979 107.02986640000006),1285,RS Umum Graha Juanda,GI01050100,Swasta / Lainnya,528c628d-bc92-447d-8d1f-a0e99c7dc40f,SRGI2013,0,"Jl. IR. H. Juanda No. 326, Bekasi Timur",Kota Bekasi,021-8811832,C
RUMAHSAKIT_PT_50K_2023_JAWABARAT.86,POINT (-6.210932368999977 106.97722210000006),1286,RS Umum Ananda,GI01050100,Swasta / Lainnya,528c628d-bc92-447d-8d1f-a0e99c7dc40f,SRGI2013,0,"Jl. Sultan Agung No. 173, Kec. Medan Satria - Kota Bekasi.",Kota Bekasi,021-8854338,B
RUMAHSAKIT_PT_50K_2023_JAWABARAT.87,POINT (-6.274670194999942 106.97673970000005),1287,RS Umum Anna,GI01050100,Swasta / Lainnya,528c628d-bc92-447d-8d1f-a0e99c7dc40f,SRGI2013,0,"Jl. Raya Pekayon Jaya No.36, Kel.Jaka Setia, Bekasi",Kota Bekasi,021-82432211,C
RUMAHSAKIT_PT_50K_2023_JAWABARAT.88,POINT (-6.26753520099993 107.08230090000006),1288,RS Umum Daerah Kab.Bekasi,GI01050100,Pemerintah Kabupaten,528c628d-bc92-447d-8d1f-a0e99c7dc40f,SRGI2013,0,"Jl. Teuku Umar Cibitung,Bekasi",Bekasi,021-88374444,B
RUMAHSAKIT_PT_50K_2023_JAWABARAT.89,POINT (-6.184926091999955 106.97762770000008),1289,RS Umum Citra Harapan,GI01050100,Swasta / Lainnya,528c628d-bc92-447d-8d1f-a0e99c7dc40f,SRGI2013,0,"Jl.Raya Harapan Indah Kawasan Sentra Niaga No. 3-5 Harapan Indah Pejuang, Medan Satria Kota Bekasi",Kota Bekasi,88870606,C
RUMAHSAKIT_PT_50K_2023_JAWABARAT.90,POINT (-6.346922194999934 106.92595440000008),1290,RS Umum Jati Sampurna,GI01050100,Swasta / Lainnya,528c628d-bc92-447d-8d1f-a0e99c7dc40f,SRGI2013,0,Jl. Rawa Dolar RT. 003 RW. 007 Kel. Jatiraden Kec. Jatisampurna,Kota Bekasi,(021) 8451457,C
RUMAHSAKIT_PT_50K_2023_JAWABARAT.91,POINT (-6.276193917999933 106.99136970000006),1291,RS Umum St. Elisabeth,GI01050100,Organisasi Sosial,528c628d-bc92-447d-8d1f-a0e99c7dc40f,SRGI2013,0,"Jl. Raya Narogong 202 KM.5,Kemang Pratama,Kel. BojongRawa Lumbu, Kec. Rawa Lumbu, Kota Bekasi.",Kota Bekasi,82430101,C
RUMAHSAKIT_PT_50K_2023_JAWABARAT.92,POINT (-6.245664876999967 107.00362750000005),1292,RS Umum Islam dr. Subki Abdulkadir,GI01050100,Organisasi Sosial,528c628d-bc92-447d-8d1f-a0e99c7dc40f,SRGI2013,0,"Jl. R.A. Kartini No.66,Bekasi",Kota Bekasi,8803386,D
RUMAHSAKIT_PT_50K_2023_JAWABARAT.93,POINT (-6.269685952999964 106.99878070000005),1293,RS Siloam Bekasi Sepanjang Jaya,GI01050100,Swasta / Lainnya,528c628d-bc92-447d-8d1f-a0e99c7dc40f,SRGI2013,0,Jl. Pramuka No. 12 Rt. 004 Rw. 002 Kel. Sepanjang Jaya Kec. Rawalumbu Bekasi,Kota Bekasi,021-50901900,C
RUMAHSAKIT_PT_50K_2023_JAWABARAT.94,POINT (-6.276742849999948 107.04767120000008),1294,RS Umum Hermina Grand Wisata,GI01050100,Swasta / Lainnya,528c628d-bc92-447d-8d1f-a0e99c7dc40f,SRGI2013,0,Jl. Festival Boulevard Blok J AI No.1 Desa Lambang Sari Kec.Tambun Selatan Kab.Bekasi,Bekasi,021-82651212,B
RUMAHSAKIT_PT_50K_2023_JAWABARAT.95,POINT (-6.3760113109999565 106.91147350000006),1295,RS Umum Permata Cibubur,GI01050100,Swasta / Lainnya,528c628d-bc92-447d-8d1f-a0e99c7dc40f,SRGI2013,0,"Jl. Alternatif Cibubur - Cileungsi No. 6A, Kec. Jati Sampurna, Bekasi",Kota Bekasi,(021) 28671144,B
RUMAHSAKIT_PT_50K_2023_JAWABARAT.96,POINT (-6.598581422999928 106.80513930000006),1296,RS Umum PMI Bogor,GI01050100,Organisasi Sosial,528c628d-bc92-447d-8d1f-a0e99c7dc40f,SRGI2013,0,Jl. Raya Pajajaran No. 80 Bogor,Kota Bogor,0251-8324080,B
RUMAHSAKIT_PT_50K_2023_JAWABARAT.97,POINT (-6.591240347999928 106.79763140000006),1297,RS Umum Salak,GI01050100,TNI AD,528c628d-bc92-447d-8d1f-a0e99c7dc40f,SRGI2013,0,Jl. Jend Sudirman No. 8 Kota Bogor,Kota Bogor,0251-8345222,C
RUMAHSAKIT_PT_50K_2023_JAWABARAT.98,POINT (-6.543964173999939 106.76277750000008),1298,RSAU Dr. M. Hassan Toto,GI01050100,TNI AU,528c628d-bc92-447d-8d1f-a0e99c7dc40f,SRGI2013,0,Jl. Sardjio No. 1 Kel. Atang Senjaya Kec. Kemang,Bogor,8111137006,C
RUMAHSAKIT_PT_50K_2023_JAWABARAT.99,POINT (-6.582838055999957 106.78043700000006),1299,RS Jiwa dr. H. Marzoeki Mahdi,GI01050100,Kementerian Kesehatan,528c628d-bc92-447d-8d1f-a0e99c7dc40f,SRGI2013,0,Jl. dr. Sumeru No.114 Kota Bogor,Kota Bogor,2518324024,A
